fishID,Date,Chamber,SMR,sdSMR,MaxMR,MinMR,FirstMR,MeanTemp...C.,Weight..kg.,Chamber.Volume..L.,BlankCorrection,Species,TL,SL,W,Close_Time,Flush_Time,Vol_Ch,Nb_Ch,Catch_Date,Run_Date,Close_Time_Blank,Flush_Time_Blank,Note,Capture,Firesting,Data,DataBlank,Vol_Ch_Bl,Nb_Ch_Bl,Start_Time,Start_Time_Bl,Chambersize,Manip,Etat
MOO18-R001,2018-03-17 16:53:25,1,0.0556187329,0.0009854298,0.1871138347,0.0542871355,0.2114820392,27.9418199183,0.000214,0.006659,YES,Gnatholepis cauerensis,29.46,23.63,0.000214,180,180,0.006659,1,16/03/2018,17/03/2018,420,180,,Lagon,FS1,FS1_17-03-18.txt,FS1blank_17-03-18.txt,0.006659,8,NA,NA,XS,Reef_services,ok
MOO18-R002,2018-03-17 16:53:25,2,0.0661954301,0.0012280309,0.1950132087,0.0637670101,0.2219342566,27.9406189009,0.000275,0.006659,YES,Gnatholepis cauerensis,32.55,27.31,0.000275,180,180,0.006659,2,16/03/2018,17/03/2018,420,180,,Lagon,FS1,FS1_17-03-18.txt,FS1blank_17-03-18.txt,0.006659,8,NA,NA,XS,Reef_services,ok
MOO18-R003,2018-03-17 16:53:25,3,0.050908134,0.0004752812,0.0894507255,0.0503419347,0.2114830371,27.9395969008,0.000222,0.006659,YES,Gnatholepis cauerensis,28.92,24.46,0.000222,180,180,0.006659,3,16/03/2018,17/03/2018,420,180,,Lagon,FS1,FS1_17-03-18.txt,FS1blank_17-03-18.txt,0.006659,8,NA,NA,XS,Reef_services,ok
MOO18-R004,2018-03-17 16:53:25,4,0.0578899751,0.0010945841,0.1941356872,0.0564916967,0.2086634573,27.9383314286,0.000228,0.006659,YES,Gnatholepis cauerensis,30.07,25.28,0.000228,180,180,0.006659,4,16/03/2018,17/03/2018,420,180,,Lagon,FS1,FS1_17-03-18.txt,FS1blank_17-03-18.txt,0.006659,8,NA,NA,XS,Reef_services,ok
MOO18-R005,2018-03-17 16:53:25,5,0.0265077569,0.0004552252,0.0626168493,0.0257109815,0.0993512627,27.8838191223,0.000075,0.006659,YES,Gnatholepis cauerensis,21.26,17.69,0.000075,180,180,0.006659,5,16/03/2018,17/03/2018,420,180,,Lagon,FS2,FS2_17-03-18.txt,FS2blank_17-03-18.txt,0.006659,8,NA,NA,XS,Reef_services,ok
MOO18-R006,2018-03-17 16:53:25,6,0.0357764137,0.0005598917,0.0688148248,0.0351574848,0.0753944926,27.8826471886,0.000091,0.006659,YES,Gnatholepis cauerensis,22.71,18.79,0.000091,180,180,0.006659,6,16/03/2018,17/03/2018,420,180,,Lagon,FS2,FS2_17-03-18.txt,FS2blank_17-03-18.txt,0.006659,8,NA,NA,XS,Reef_services,ok
MOO18-R007,2018-03-17 16:53:25,7,0.0557799898,0.0013836868,0.1973299708,0.0541025836,0.217719201,27.8817169133,0.000311,0.006659,YES,Gnatholepis cauerensis,34.32,28.09,0.000311,180,180,0.006659,7,16/03/2018,17/03/2018,420,180,,Lagon,FS2,FS2_17-03-18.txt,FS2blank_17-03-18.txt,0.006659,8,NA,NA,XS,Reef_services,ok
MOO18-R008,2018-03-18 14:59:13,1,0.0031909443,0.0002282057,0.0129427673,0.0029469149,0.0131444681,28.0446626773,0.000035,0.006659,YES,Eviota afelei,15.19,12.56,0.000035,540,180,0.006659,1,17/03/2018,18/03/2018,420,180,,Lagon,FS1,FS1_18-03-18.txt,FS1blank_18-03-18.txt,0.006659,8,NA,NA,XS,Reef_services,ok
MOO18-R009,2018-03-18 14:59:13,2,0.0016013188,0.0002251347,0.0088227246,0.0013792165,0.0101029715,28.0443814558,0.000025,0.006659,YES,Eviota afelei,12.83,11.01,0.000025,540,180,0.006659,2,17/03/2018,18/03/2018,420,180,,Lagon,FS1,FS1_18-03-18.txt,FS1blank_18-03-18.txt,0.006659,8,NA,NA,XS,Reef_services,ok
MOO18-R010,2018-03-18 14:59:13,3,-0.0039823496,0.0001241022,0.0090302646,-0.0041682313,0.0105397474,28.0444842463,0.000021,0.006659,YES,Eviota afelei,13.4,10.81,0.000021,540,180,0.006659,3,17/03/2018,18/03/2018,420,180,,Lagon,FS1,FS1_18-03-18.txt,FS1blank_18-03-18.txt,0.006659,8,NA,NA,XS,Reef_services,ok
MOO18-R011,2018-03-18 14:59:13,4,0.0053166923,0.0002102582,0.0149384184,0.0050464391,0.0139200124,28.0450604438,0.000043,0.006659,YES,Eviota afelei,16.71,13.63,0.000043,540,180,0.006659,4,17/03/2018,18/03/2018,420,180,,Lagon,FS1,FS1_18-03-18.txt,FS1blank_18-03-18.txt,0.006659,8,NA,NA,XS,Reef_services,ok
MOO18-R012,2018-03-18 14:59:13,5,0.005199176,0.0002773899,0.0119025219,0.0047461165,0.0125368261,27.9912119101,0.000035,0.006659,YES,Eviota afelei,15.33,12.65,0.000035,540,180,0.006659,5,17/03/2018,18/03/2018,420,180,,Lagon,FS2,FS2_18-03-18.txt,FS2blank_18-03-18.txt,0.006659,8,NA,NA,XS,Reef_services,ok
MOO18-R013,2018-03-18 14:59:13,6,0.0080019727,0.0001205513,0.0242084902,0.0078052875,0.0234689533,27.9928614633,0.000052,0.006659,YES,Eviota afelei,17.72,14.65,0.000052,540,180,0.006659,6,17/03/2018,18/03/2018,420,180,,Lagon,FS2,FS2_18-03-18.txt,FS2blank_18-03-18.txt,0.006659,8,NA,NA,XS,Reef_services,ok
MOO18-R014,2018-03-18 14:59:13,7,0.0033927601,0.0002572533,0.0090608492,0.003115466,0.0068628782,27.9950742165,0.000026,0.006659,YES,Eviota afelei,14.13,11.23,0.000026,540,180,0.006659,7,17/03/2018,18/03/2018,420,180,,Lagon,FS2,FS2_18-03-18.txt,FS2blank_18-03-18.txt,0.006659,8,NA,NA,XS,Reef_services,ok
MOO18-R015,2018-03-19 16:31:57,2,0.0354470694,0.0004795884,0.0538428895,0.0347131351,-0.0049151843,28.120779798,0.000107,0.006659,YES,Glyptoparus delicatulus,25.24,22.08,0.000107,180,180,0.006659,2,18/03/2018,19/03/2018,420,180,16:45:01,Lagon,FS1,FS1_19-03-18.txt,FS1blank_19-03-18.txt,0.006659,1,14:54:01,09:13:01,XS,Reef_services,ok
MOO18-R016,2018-03-19 16:31:57,3,0.0428951063,0.0003464317,0.0769815641,0.0423126085,-0.0065611881,28.120606437,0.000134,0.006659,YES,Glyptoparus delicatulus,26.9,23.15,0.000134,180,180,0.006659,3,18/03/2018,19/03/2018,420,180,16:45:01,Lagon,FS1,FS1_19-03-18.txt,FS1blank_19-03-18.txt,0.006659,1,14:54:01,09:13:01,XS,Reef_services,ok
MOO18-R017,2018-03-19 16:31:57,4,0.0293684483,0.0003160384,0.0499712278,0.0287595036,-0.0041331953,28.1199978409,0.000077,0.006659,YES,Glyptoparus delicatulus,22.66,19.41,0.000077,180,180,0.006659,4,18/03/2018,19/03/2018,420,180,16:45:01,Lagon,FS1,FS1_19-03-18.txt,FS1blank_19-03-18.txt,0.006659,1,14:54:01,09:13:01,XS,Reef_services,ok
MOO18-R018,2018-03-19 16:31:57,5,0.0375540847,0.00034135,0.0640655953,0.0369609669,-0.0031816578,28.0645738136,0.000133,0.006659,YES,Glyptoparus delicatulus,26.28,22.82,0.000133,180,180,0.006659,5,18/03/2018,19/03/2018,420,180,16:45:01,Lagon,FS1,FS1_19-03-18.txt,FS1blank_19-03-18.txt,0.006659,1,14:54:01,09:13:01,XS,Reef_services,ok
MOO18-R019,2018-03-19 16:31:57,6,0.0201551004,0.0010349962,0.039914475,0.0189996921,-0.0024543529,28.0643785961,0.000053,0.006659,YES,Glyptoparus delicatulus,19.78,17.1,0.000053,180,180,0.006659,6,18/03/2018,19/03/2018,420,180,16:45:01,Lagon,FS2,FS2_19-03-18.txt,FS2blank_19-03-18.txt,0.006659,1,14:54:01,09:13:01,XS,Reef_services,ok
MOO18-R020,2018-03-19 16:31:57,7,0.0131659031,0.0004691277,0.0261728115,0.0124933909,-0.001952591,28.0646313839,0.00002,0.006659,YES,Glyptoparus delicatulus,14.61,12.76,0.00002,180,180,0.006659,7,18/03/2018,19/03/2018,420,180,16:45:01,Lagon,FS2,FS2_19-03-18.txt,FS2blank_19-03-18.txt,0.006659,1,14:54:01,09:13:01,XS,Reef_services,ok
MOO18-R021,2018-03-19 16:31:57,8,0.0504469932,0.0005815072,0.0906649967,0.0494648155,-0.009325142,28.0654009324,0.000177,0.006659,YES,Glyptoparus delicatulus,28.93,25.25,0.000177,180,180,0.006659,8,18/03/2018,19/03/2018,420,180,,Lagon,FS2,FS2_19-03-18.txt,FS2blank_19-03-18.txt,0.006659,1,14:54:01,09:13:01,XS,Reef_services,ok
MOO18-R022,2018-03-20 13:51:58,1,0.0802406143,0.0015101382,0.2829587486,0.0778550214,0.3141149542,28.070355545,0.000389,0.006659,YES,Gnatholepis cauerensis,34.76,29.04,0.000389,180,180,0.006659,1,16/03/2018,20/03/2018,420,180,,Lagon,FS1,FS1_20-03-18.txt,FS1blank_20-03-18.txt,0.006659,8,13:55:01,09:12:01,XS,Reef_services,ok
MOO18-R023,2018-03-20 13:51:58,2,0.0908629666,0.0014202858,0.2271756626,0.0884775409,0.3248294354,28.0691402871,0.000433,0.006659,YES,Gnatholepis cauerensis,36.53,30.98,0.000433,180,180,0.006659,2,16/03/2018,20/03/2018,420,180,,Lagon,FS1,FS1_20-03-18.txt,FS1blank_20-03-18.txt,0.006659,8,13:55:01,09:12:01,XS,Reef_services,ok
MOO18-R024,2018-03-20 13:51:58,3,0.0568798968,0.0009779054,0.200349048,0.0551019243,0.2315385565,28.0681873978,0.000203,0.006659,YES,Gnatholepis cauerensis,28.92,24.53,0.000203,180,180,0.006659,3,16/03/2018,20/03/2018,420,180,,Lagon,FS1,FS1_20-03-18.txt,FS1blank_20-03-18.txt,0.006659,8,13:55:01,09:12:01,XS,Reef_services,ok
MOO18-R025,2018-03-20 13:51:58,4,0.0531553783,0.0015534279,0.1746101532,0.0497230393,0.1876709423,28.0674189555,0.000216,0.006659,YES,Gnatholepis cauerensis,29.17,24.25,0.000216,180,180,0.006659,4,16/03/2018,20/03/2018,420,180,,Lagon,FS1,FS1_20-03-18.txt,FS1blank_20-03-18.txt,0.006659,8,13:55:01,09:12:01,XS,Reef_services,ok
MOO18-R026,2018-03-20 13:51:58,5,0.0400454319,0.0009253791,0.15050283,0.0382988011,0.1449857172,28.0097508994,0.000149,0.006659,YES,Gnatholepis cauerensis,26,21.7,0.000149,180,180,0.006659,5,16/03/2018,20/03/2018,420,180,,Lagon,FS2,FS2_20-03-18.txt,FS2blank_20-03-18.txt,0.006659,8,13:55:01,09:12:01,XS,Reef_services,ok
MOO18-R027,2018-03-20 13:51:58,6,0.0513769866,0.0006671255,0.1665347838,0.0502273009,0.1571864573,28.0092498534,0.00022,0.006659,YES,Gnatholepis cauerensis,29.66,25.07,0.00022,180,180,0.006659,6,16/03/2018,20/03/2018,420,180,,Lagon,FS2,FS2_20-03-18.txt,FS2blank_20-03-18.txt,0.006659,8,13:55:01,09:12:01,XS,Reef_services,ok
MOO18-R028,2018-03-20 13:51:58,7,0.0448216917,0.0006908531,0.1786331087,0.0437591389,0.1919509691,28.0086374447,0.000172,0.006659,YES,Gnatholepis cauerensis,27.27,22.58,0.000172,180,180,0.006659,7,16/03/2018,20/03/2018,420,180,,Lagon,FS2,FS2_20-03-18.txt,FS2blank_20-03-18.txt,0.006659,8,13:55:01,09:12:01,XS,Reef_services,ok
MOO18-R029,2018-03-21 14:12:03,1,0.0083174293,0.0006579779,0.0237395004,0.0072825349,0.0259711827,28.0289572598,0.000056,0.006659,YES,Eviota afelei,18.29,14.97,0.000056,540,180,0.006659,1,17/03/2018,21/03/2018,420,180,,Lagon,FS1,FS1_21-03-18.txt,FS1blank_21-03-18.txt,0.006659,8,14:29:01,09:00:01,XS,Reef_services,ok
MOO18-R030,2018-03-21 14:12:03,2,0.0044006206,0.0001233997,0.0116552452,0.0042018335,0.0134203832,28.0271745154,0.000028,0.006659,YES,Eviota afelei,14.44,12.51,0.000028,540,180,0.006659,2,17/03/2018,21/03/2018,420,180,,Lagon,FS1,FS1_21-03-18.txt,FS1blank_21-03-18.txt,0.006659,8,14:29:01,09:00:01,XS,Reef_services,ok
MOO18-R031,2018-03-21 14:12:03,3,0.00242951,5.32653810466664E-05,0.0075583347,0.0023633596,0.0089348128,28.026234186,0.000022,0.006659,YES,Eviota afelei,13.41,11.13,0.000022,540,180,0.006659,3,17/03/2018,21/03/2018,420,180,,Lagon,FS1,FS1_21-03-18.txt,FS1blank_21-03-18.txt,0.006659,8,14:29:01,09:00:01,XS,Reef_services,ok
MOO18-R032,2018-03-21 14:12:03,4,0.0005295695,0.0001332375,0.0081475327,0.0003664853,0.01336305,28.0257778046,0.000018,0.006659,YES,Eviota afelei,13.75,11.47,0.000018,540,180,0.006659,4,17/03/2018,21/03/2018,420,180,,Lagon,FS1,FS1_21-03-18.txt,FS1blank_21-03-18.txt,0.006659,8,14:29:01,09:00:01,XS,Reef_services,ok
MOO18-R033,2018-03-21 14:12:03,5,0.0007949104,0.000199525,0.00481491,0.0005284997,0.0102298697,27.9729260944,0.000013,0.006659,YES,Eviota afelei,11.66,10.01,0.000013,540,180,0.006659,5,17/03/2018,21/03/2018,420,180,,Lagon,FS2,FS2_21-03-18.txt,FS2blank_21-03-18.txt,0.006659,8,14:29:01,09:00:01,XS,Reef_services,ok
MOO18-R034,2018-03-21 14:12:03,6,0.0026920016,0.0001825193,0.0069002484,0.0023487423,0.0152038714,27.9714519545,0.000024,0.006659,YES,Eviota afelei,13.56,11.98,0.000024,540,180,0.006659,6,17/03/2018,21/03/2018,420,180,,Lagon,FS2,FS2_21-03-18.txt,FS2blank_21-03-18.txt,0.006659,8,14:29:01,09:00:01,XS,Reef_services,ok
MOO18-R035,2018-03-21 14:12:03,7,0.0040556683,0.0001529405,0.0092935152,0.0038158396,0.0280391025,27.9708010013,0.000062,0.006659,YES,Eviota afelei,19.28,16.31,0.000062,540,180,0.006659,7,17/03/2018,21/03/2018,420,180,,Lagon,FS2,FS2_21-03-18.txt,FS2blank_21-03-18.txt,0.006659,8,14:29:01,09:00:01,XS,Reef_services,ok
MOO18-R036,2018-03-22 12:51:56,1,0.0193210711,0.0004317628,0.0797065786,0.0187030856,0.0919624287,28.0625003711,0.00006,0.006659,YES,Glyptoparus delicatulus,21.47,18.41,0.00006,180,180,0.006659,1,18/03/2018,22/03/2018,420,180,,Lagon,FS1,FS1_22-03-18.txt,FS1blank_22-03-18.txt,0.006659,8,12:55:01,08:44:01,XS,Reef_services,ok
MOO18-R037,2018-03-22 12:51:56,2,0.0343213168,0.0005510357,0.1539669542,0.0331646954,0.1745707692,28.0627628904,0.000174,0.006659,YES,Glyptoparus delicatulus,30.52,26.81,0.000174,180,180,0.006659,2,18/03/2018,22/03/2018,420,180,,Lagon,FS1,FS1_22-03-18.txt,FS1blank_22-03-18.txt,0.006659,8,12:55:01,08:44:01,XS,Reef_services,ok
MOO18-R038,2018-03-22 12:51:56,3,0.0465851565,0.0007558982,0.214802028,0.0452889081,0.240130449,28.0632781631,0.000205,0.006659,YES,Glyptoparus delicatulus,31.01,26.9,0.000205,180,180,0.006659,3,18/03/2018,22/03/2018,420,180,,Lagon,FS1,FS1_22-03-18.txt,FS1blank_22-03-18.txt,0.006659,8,12:55:01,08:44:01,XS,Reef_services,ok
MOO18-R039,2018-03-22 12:51:56,4,0.0372642423,0.0005635716,0.1757182165,0.0362611493,0.1935318243,28.0635729628,0.000192,0.006659,YES,Glyptoparus delicatulus,30.3,25.76,0.000192,180,180,0.006659,4,18/03/2018,22/03/2018,420,180,,Lagon,FS1,FS1_22-03-18.txt,FS1blank_22-03-18.txt,0.006659,8,12:55:01,08:44:01,XS,Reef_services,ok
MOO18-R040,2018-03-22 12:51:56,5,0.0311493797,0.0003261109,0.1293318423,0.0305011935,0.1457829236,28.0107822145,0.000124,0.006659,YES,Glyptoparus delicatulus,25.85,22.43,0.000124,180,180,0.006659,5,18/03/2018,22/03/2018,420,180,,Lagon,FS2,FS2_22-03-18.txt,FS2blank_22-03-18.txt,0.006659,8,12:55:01,08:44:01,XS,Reef_services,ok
MOO18-R041,2018-03-22 12:51:56,6,0.0550156042,0.0010306746,0.2128447823,0.0533453671,0.2215581186,28.0111377739,0.000202,0.006659,YES,Glyptoparus delicatulus,30.13,25.75,0.000202,180,180,0.006659,6,18/03/2018,22/03/2018,420,180,,Lagon,FS2,FS2_22-03-18.txt,FS2blank_22-03-18.txt,0.006659,8,12:55:01,08:44:01,XS,Reef_services,ok
MOO18-R042,2018-03-22 12:51:56,7,0.0331260616,0.0007225836,0.1201601794,0.0316169735,0.1271441295,28.0112868421,0.000117,0.006659,YES,Glyptoparus delicatulus,26.02,22.81,0.000117,180,180,0.006659,7,18/03/2018,22/03/2018,420,180,,Lagon,FS2,FS2_22-03-18.txt,FS2blank_22-03-18.txt,0.006659,8,12:55:01,08:44:01,XS,Reef_services,ok
MOO18-R043,2018-03-23 13:29:22,1,0.0703547498,0.0009595884,0.2258198306,0.0688825266,0.252578396,28.1240344892,0.000312,0.006659,YES,Gnatholepis cauerensis,21.47,18.41,0.000312,180,180,0.006659,1,16/03/2018,23/03/2018,420,180,,Lagon,FS1,FS1_23-03-18.txt,FS1blank_23-03-18.txt,0.006659,8,13:35:01,09:10:01,XS,Reef_services,ok
MOO18-R044,2018-03-23 13:29:22,2,0.0798629195,0.0013264256,0.2829428074,0.0778403407,0.3184751422,28.1231892605,0.000417,0.006659,YES,Gnatholepis cauerensis,30.52,26.81,0.000417,180,180,0.006659,2,16/03/2018,23/03/2018,420,180,,Lagon,FS1,FS1_23-03-18.txt,FS1blank_23-03-18.txt,0.006659,8,13:35:01,09:10:01,XS,Reef_services,ok
MOO18-R045,2018-03-23 13:29:22,3,0.0384631423,0.0004717504,0.1383255885,0.0377758188,0.1526412853,28.122983428,0.000141,0.006659,YES,Gnatholepis cauerensis,31.01,26.9,0.000141,180,180,0.006659,3,16/03/2018,23/03/2018,420,180,,Lagon,FS1,FS1_23-03-18.txt,FS1blank_23-03-18.txt,0.006659,8,13:35:01,09:10:01,XS,Reef_services,ok
MOO18-R046,2018-03-23 13:29:22,4,0.0609621184,0.0015310973,0.2021484545,0.0585726571,0.2365448534,28.1221678248,0.000254,0.006659,YES,Gnatholepis cauerensis,30.3,25.76,0.000254,180,180,0.006659,4,16/03/2018,23/03/2018,420,180,,Lagon,FS1,FS1_23-03-18.txt,FS1blank_23-03-18.txt,0.006659,8,13:35:01,09:10:01,XS,Reef_services,ok
MOO18-R047,2018-03-23 13:29:22,5,0.0559645713,0.0006594638,0.1916466146,0.054850318,0.2192984512,28.0672055502,0.000265,0.006659,YES,Gnatholepis cauerensis,25.85,22.43,0.000265,180,180,0.006659,5,16/03/2018,23/03/2018,420,180,,Lagon,FS2,FS2_23-03-18.txt,FS2blank_23-03-18.txt,0.006659,8,13:35:01,09:10:01,XS,Reef_services,ok
MOO18-R048,2018-03-23 13:29:22,6,0.050592633,0.0008296769,0.172012132,0.0491971854,0.1964368897,28.0660901395,0.000202,0.006659,YES,Gnatholepis cauerensis,30.13,25.75,0.000202,180,180,0.006659,6,16/03/2018,23/03/2018,420,180,,Lagon,FS2,FS2_23-03-18.txt,FS2blank_23-03-18.txt,0.006659,8,13:35:01,09:10:01,XS,Reef_services,ok
MOO18-R049,2018-03-23 13:29:22,7,0.0413324976,0.0008346318,0.1344945261,0.0393411421,0.1450973783,28.0654685687,0.00016,0.006659,YES,Gnatholepis cauerensis,26.02,22.81,0.00016,180,180,0.006659,7,16/03/2018,23/03/2018,420,180,,Lagon,FS2,FS2_23-03-18.txt,FS2blank_23-03-18.txt,0.006659,8,13:35:01,09:10:01,XS,Reef_services,ok
MOO18-R050,2018-03-24 11:49:45,1,0.0095135439,0.0001215973,0.0352137658,0.0093197094,0.0310090819,28.0376781546,0.000037,0.006659,YES,Eviota afelei,15.46,13.28,0.000037,540,180,0.006659,1,17/03/2018,24/03/2018,420,180,,Lagon,FS1,FS1_24-03-18.txt,FS1blank_24-03-18.txt,0.006659,8,11:54:01,08:24:01,XS,Reef_services,ok
MOO18-R051,2018-03-24 11:49:45,2,0.0064421558,0.0001674961,0.0127036725,0.0061684452,0.0176325376,28.0372188511,0.000021,0.006659,YES,Eviota afelei,13.58,11.24,0.000021,540,180,0.006659,2,17/03/2018,24/03/2018,420,180,,Lagon,FS1,FS1_24-03-18.txt,FS1blank_24-03-18.txt,0.006659,8,11:54:01,08:24:01,XS,Reef_services,ok
MOO18-R052,2018-03-24 11:49:45,3,0.0051547202,7.68067149432318E-05,0.0147108549,0.005092866,0.0171902219,28.0364649473,0.000022,0.006659,YES,Eviota afelei,13.64,11.79,0.000022,540,180,0.006659,3,17/03/2018,24/03/2018,420,180,,Lagon,FS1,FS1_24-03-18.txt,FS1blank_24-03-18.txt,0.006659,8,11:54:01,08:24:01,XS,Reef_services,ok
MOO18-R053,2018-03-24 11:49:45,4,0.0065456611,4.1958629761974E-05,0.018251949,0.0065084015,0.0221327485,28.0354910986,0.00002,0.006659,YES,Eviota afelei,12.83,11.18,0.00002,540,180,0.006659,4,17/03/2018,24/03/2018,420,180,,Lagon,FS1,FS1_24-03-18.txt,FS1blank_24-03-18.txt,0.006659,8,11:54:01,08:24:01,XS,Reef_services,ok
MOO18-R054,2018-03-24 11:49:45,5,0.0076022893,0.0001672535,0.0196226767,0.0073349465,0.0270037194,27.9840588598,0.000045,0.006659,YES,Eviota afelei,16.96,14.43,0.000045,540,180,0.006659,5,17/03/2018,24/03/2018,420,180,,Lagon,FS2,FS2_24-03-18.txt,FS2blank_24-03-18.txt,0.006659,8,11:54:01,08:24:01,XS,Reef_services,ok
MOO18-R055,2018-03-24 11:49:45,6,0.0048463534,0.0001443463,0.0132240111,0.0046682235,0.018700633,27.9829022436,0.00002,0.006659,YES,Eviota afelei,13.08,11.3,0.00002,540,180,0.006659,6,17/03/2018,24/03/2018,420,180,,Lagon,FS2,FS2_24-03-18.txt,FS2blank_24-03-18.txt,0.006659,8,11:54:01,08:24:01,XS,Reef_services,ok
MOO18-R056,2018-03-24 11:49:45,7,0.0078028173,0.0001572294,0.0184702748,0.0075329404,0.0257399556,27.9817196581,0.000032,0.006659,YES,Eviota afelei,15.5,13.38,0.000032,540,180,0.006659,7,17/03/2018,24/03/2018,420,180,,Lagon,FS2,FS2_24-03-18.txt,FS2blank_24-03-18.txt,0.006659,8,11:54:01,08:24:01,XS,Reef_services,ok
MOO18-R057,2018-03-25 12:54:34,1,0.0469976212,0.0008668409,0.2183139237,0.0457752627,0.247642291,28.0191613871,0.000212,0.006659,YES,Glyptoparus delicatulus,31.54,27.55,0.000212,180,180,0.006659,1,18/03/2018,25/03/2018,420,180,,Lagon,FS1,FS1_25-03-18.txt,FS1blank_25-03-18.txt,0.006659,8,12:58:01,08:32:01,XS,Reef_services,ok
MOO18-R058,2018-03-25 12:54:34,2,0.0277373484,0.0003867059,0.1425883538,0.0271332972,0.1499510846,28.0188066886,0.000133,0.006659,YES,Glyptoparus delicatulus,27.48,23.53,0.000133,180,180,0.006659,2,18/03/2018,25/03/2018,420,180,,Lagon,FS1,FS1_25-03-18.txt,FS1blank_25-03-18.txt,0.006659,8,12:58:01,08:32:01,XS,Reef_services,ok
MOO18-R059,2018-03-25 12:54:34,3,0.038912122,0.0006276937,0.1206768633,0.0379504227,0.13414752,28.0180443182,0.000107,0.006659,YES,Glyptoparus delicatulus,25.14,21.78,0.000107,180,180,0.006659,3,18/03/2018,25/03/2018,420,180,,Lagon,FS1,FS1_25-03-18.txt,FS1blank_25-03-18.txt,0.006659,8,12:58:01,08:32:01,XS,Reef_services,ok
MOO18-R060,2018-03-25 12:54:34,4,0.0299410622,0.0005856928,0.1265905987,0.0291444836,0.1230643716,28.0178845312,0.000106,0.006659,YES,Glyptoparus delicatulus,25.68,22.81,0.000106,180,180,0.006659,4,18/03/2018,25/03/2018,420,180,,Lagon,FS1,FS1_25-03-18.txt,FS1blank_25-03-18.txt,0.006659,8,12:58:01,08:32:01,XS,Reef_services,ok
MOO18-R061,2018-03-25 12:54:34,5,0.0366887837,0.0006151412,0.1442669728,0.0357179333,0.1290940705,27.9661337799,0.000108,0.006659,YES,Glyptoparus delicatulus,26.25,22.43,0.000108,180,180,0.006659,5,18/03/2018,25/03/2018,420,180,,Lagon,FS2,FS2_25-03-18.txt,FS2blank_25-03-18.txt,0.006659,8,12:58:01,08:32:01,XS,Reef_services,ok
MOO18-R062,2018-03-25 12:54:34,6,0.0363219148,0.0004832037,0.1339596532,0.0355990277,0.1467097766,27.9655272727,0.000144,0.006659,YES,Glyptoparus delicatulus,28.12,24.37,0.000144,180,180,0.006659,6,18/03/2018,25/03/2018,420,180,,Lagon,FS2,FS2_25-03-18.txt,FS2blank_25-03-18.txt,0.006659,8,12:58:01,08:32:01,XS,Reef_services,ok
MOO18-R063,2018-03-25 12:54:34,7,0.0342672042,0.0006540852,0.153318243,0.0332388748,0.1763804633,27.9660434236,0.000096,0.006659,YES,Glyptoparus delicatulus,23.73,20.11,0.000096,180,180,0.006659,7,18/03/2018,25/03/2018,420,180,,Lagon,FS2,FS2_25-03-18.txt,FS2blank_25-03-18.txt,0.006659,8,12:58:01,08:32:01,XS,Reef_services,ok
MOO18-R064,2018-03-26 11:17:35,1,0.0539144968,0.0006508592,0.1985541189,0.0530410428,0.2127204256,28.0629031469,0.000243,0.006659,YES,Gnatholepis cauerensis,30.6,25.6,0.000243,180,180,0.006659,1,16/03/2018,26/03/2018,420,180,,Lagon,FS1,FS1_26-03-18.txt,FS1blank_26-03-18.txt,0.006659,8,11:21:01,08:23:01,XS,Reef_services,ok
MOO18-R065,2018-03-26 11:17:35,2,0.0418830767,0.0006737529,0.1314916744,0.0407914258,0.1489635297,28.0631661836,0.000158,0.006659,YES,Gnatholepis cauerensis,27.71,22.8,0.000158,180,180,0.006659,2,16/03/2018,26/03/2018,420,180,,Lagon,FS1,FS1_26-03-18.txt,FS1blank_26-03-18.txt,0.006659,8,11:21:01,08:23:01,XS,Reef_services,ok
MOO18-R066,2018-03-26 11:17:35,3,0.0539641576,0.0010554552,0.1753862314,0.0525135203,0.2123608847,28.0634383054,0.000199,0.006659,YES,Gnatholepis cauerensis,28.4,23.4,0.000199,180,180,0.006659,3,16/03/2018,26/03/2018,420,180,,Lagon,FS1,FS1_26-03-18.txt,FS1blank_26-03-18.txt,0.006659,8,11:21:01,08:23:01,XS,Reef_services,ok
MOO18-R067,2018-03-26 11:17:35,4,0.0730798457,0.0013612093,0.2273443512,0.0703115801,0.2310595153,28.0636615521,0.000419,0.006659,YES,Gnatholepis cauerensis,37.27,30.14,0.000419,180,180,0.006659,4,16/03/2018,26/03/2018,420,180,,Lagon,FS1,FS1_26-03-18.txt,FS1blank_26-03-18.txt,0.006659,8,11:21:01,08:23:01,XS,Reef_services,ok
MOO18-R068,2018-03-26 11:17:35,5,0.0984298985,0.0014694297,0.3013680201,0.096469041,0.3267048226,28.0115402852,0.000616,0.006659,YES,Gnatholepis cauerensis,40.36,33.42,0.000616,180,180,0.006659,5,16/03/2018,26/03/2018,420,180,,Lagon,FS2,FS2_26-03-18.txt,FS2blank_26-03-18.txt,0.006659,8,11:21:01,08:23:01,XS,Reef_services,ok
MOO18-R069,2018-03-26 11:17:35,6,0.054261962,0.0010615548,0.1766832873,0.0527196747,0.1956523903,28.0118911778,0.000233,0.006659,YES,Gnatholepis cauerensis,30.47,24.99,0.000233,180,180,0.006659,6,16/03/2018,26/03/2018,420,180,,Lagon,FS2,FS2_26-03-18.txt,FS2blank_26-03-18.txt,0.006659,8,11:21:01,08:23:01,XS,Reef_services,ok
MOO18-R070,2018-03-26 11:17:35,7,0.0502665182,0.000997521,0.1977273051,0.0488444566,0.2182075071,28.0122031503,0.00025,0.006659,YES,Gnatholepis cauerensis,32.11,26.42,0.00025,180,180,0.006659,7,16/03/2018,26/03/2018,420,180,,Lagon,FS2,FS2_26-03-18.txt,FS2blank_26-03-18.txt,0.006659,8,11:21:01,08:23:01,XS,Reef_services,ok
MOO18-R071,2018-03-27 13:10:38,1,0.0100070375,0.0002724862,0.0187557596,0.0096498489,0.0286740104,28.0847565847,0.000035,0.006659,YES,Eviota afelei,15.46,13.04,0.000035,540,180,0.006659,1,17/03/2018,27/03/2018,420,180,,Lagon,FS1,FS1_27-03-18.txt,FS1blank_27-03-18.txt,0.006659,8,13:13:01,08:59:01,XS,Reef_services,ok
MOO18-R072,2018-03-27 13:10:38,2,0.008723827,0.0003646308,0.0198031956,0.0082369012,0.0317420352,28.0835237025,0.000031,0.006659,YES,Eviota afelei,14.64,12.47,0.000031,540,180,0.006659,2,17/03/2018,27/03/2018,420,180,,Lagon,FS1,FS1_27-03-18.txt,FS1blank_27-03-18.txt,0.006659,8,13:13:01,08:59:01,XS,Reef_services,ok
MOO18-R073,2018-03-27 13:10:38,3,0.0113343916,9.92456960062777E-05,0.0220979994,0.0112133971,0.0335909563,28.0843887108,0.000027,0.006659,YES,Eviota afelei,14.28,12.18,0.000027,540,180,0.006659,3,17/03/2018,27/03/2018,420,180,,Lagon,FS1,FS1_27-03-18.txt,FS1blank_27-03-18.txt,0.006659,8,13:13:01,08:59:01,XS,Reef_services,ok
MOO18-R074,2018-03-27 13:10:38,4,-0.0009272555,0.0003775749,0.0277338744,-0.0013654431,0.0217039818,28.0838252362,0.000021,0.006659,YES,Eviota afelei,13.54,11.5,0.000021,540,180,0.006659,4,17/03/2018,27/03/2018,420,180,,Lagon,FS1,FS1_27-03-18.txt,FS1blank_27-03-18.txt,0.006659,8,13:13:01,08:59:01,XS,Reef_services,ok
MOO18-R075,2018-03-27 13:10:38,5,0.011283567,0.0001974023,0.0281719738,0.011014546,0.0381118916,28.0329656858,0.000043,0.006659,YES,Eviota afelei,16.65,13.9,0.000043,540,180,0.006659,5,17/03/2018,27/03/2018,420,180,,Lagon,FS2,FS2_27-03-18.txt,FS2blank_27-03-18.txt,0.006659,8,13:13:01,08:59:01,XS,Reef_services,ok
MOO18-R076,2018-03-27 13:10:38,6,0.0086463431,0.0001805973,0.0198591255,0.0084777128,0.0292226383,28.0325220773,0.000027,0.006659,YES,Eviota afelei,14.65,12.03,0.000027,540,180,0.006659,6,17/03/2018,27/03/2018,420,180,,Lagon,FS2,FS2_27-03-18.txt,FS2blank_27-03-18.txt,0.006659,8,13:13:01,08:59:01,XS,Reef_services,ok
MOO18-R077,2018-03-27 13:10:38,7,0.0117785185,0.0003827828,0.0203427619,0.0113439557,0.0157583846,28.0329655874,0.000014,0.006659,YES,Eviota afelei,11.83,10.01,0.000014,540,180,0.006659,7,17/03/2018,27/03/2018,420,180,,Lagon,FS2,FS2_27-03-18.txt,FS2blank_27-03-18.txt,0.006659,8,13:13:01,08:59:01,XS,Reef_services,ok
MOO18-R078,2018-03-28 13:12:42,1,0.0351120653,0.0004167199,0.1638720642,0.0345854179,0.1679058378,28.0372579904,0.000137,0.006659,YES,Glyptoparus delicatulus,28.66,25.02,0.000137,180,180,0.006659,1,18/03/2018,28/03/2018,420,180,,Lagon,FS1,FS1_28-03-18.txt,FS1blank_28-03-18.txt,0.006659,8,13:16:01,08:31:01,XS,Reef_services,ok
MOO18-R079,2018-03-28 13:12:42,2,0.020685637,0.0005900674,0.0907928215,0.0198342893,0.09792099,28.0361977874,0.000076,0.006659,YES,Glyptoparus delicatulus,22.93,19.8,0.000076,180,180,0.006659,2,18/03/2018,28/03/2018,420,180,,Lagon,FS1,FS1_28-03-18.txt,FS1blank_28-03-18.txt,0.006659,8,13:16:01,08:31:01,XS,Reef_services,ok
MOO18-R080,2018-03-28 13:12:42,3,0.0325776206,0.0003512441,0.147178881,0.0318994534,0.0854560328,28.0353590909,0.00012,0.006659,YES,Glyptoparus delicatulus,26.59,23.43,0.00012,180,180,0.006659,3,18/03/2018,28/03/2018,420,180,,Lagon,FS1,FS1_28-03-18.txt,FS1blank_28-03-18.txt,0.006659,8,13:16:01,08:31:01,XS,Reef_services,ok
MOO18-R081,2018-03-28 13:12:42,4,0.0269009229,0.0006894431,0.1155275055,0.0258274539,0.1135777572,28.0352123481,0.000087,0.006659,YES,Glyptoparus delicatulus,22.9,20,0.000087,180,180,0.006659,4,18/03/2018,28/03/2018,420,180,,Lagon,FS1,FS1_28-03-18.txt,FS1blank_28-03-18.txt,0.006659,8,13:16:01,08:31:01,XS,Reef_services,ok
MOO18-R082,2018-03-28 13:12:42,5,0.044798751,0.0005875325,0.2024986423,0.043928627,0.230242378,27.9826386898,0.000169,0.006659,YES,Glyptoparus delicatulus,28.38,24.55,0.000169,180,180,0.006659,5,18/03/2018,28/03/2018,420,180,,Lagon,FS2,FS2_28-03-18.txt,FS2blank_28-03-18.txt,0.006659,8,13:16:01,08:31:01,XS,Reef_services,ok
MOO18-R083,2018-03-28 13:12:42,6,0.0408909367,0.0008745277,0.1662177479,0.0396379282,0.1860377614,27.9815515516,0.000146,0.006659,YES,Glyptoparus delicatulus,28.09,24.48,0.000146,180,180,0.006659,6,18/03/2018,28/03/2018,420,180,,Lagon,FS2,FS2_28-03-18.txt,FS2blank_28-03-18.txt,0.006659,8,13:16:01,08:31:01,XS,Reef_services,ok
MOO18-R084,2018-03-28 13:12:42,7,0.0244139788,0.0005949066,0.0775675458,0.0237019811,0.0897476914,27.9818291063,0.000068,0.006659,YES,Glyptoparus delicatulus,21.94,18.9,0.000068,180,180,0.006659,7,18/03/2018,28/03/2018,420,180,,Lagon,FS2,FS2_28-03-18.txt,FS2blank_28-03-18.txt,0.006659,8,13:16:01,08:31:01,XS,Reef_services,ok
MOO18-R085,2018-03-29 11:03:40,1,0.0474851473,0.0012333533,0.1577731053,0.0454193246,0.1670931645,28.0659746998,0.000202,0.006659,YES,Gnatholepis cauerensis,28.09,22.8,0.000202,180,180,0.006659,1,16/03/2018,29/03/2018,420,180,,Lagon,FS1,FS1_29-03-18.txt,FS1blank_29-03-18.txt,0.006659,7,11:07:01,08:26:01,XS,Reef_services,ok
MOO18-R086,2018-03-29 11:03:40,2,0.0644754317,0.000574115,0.2204226724,0.0635328252,0.2362781614,28.0651996553,0.000308,0.006659,YES,Gnatholepis cauerensis,32.75,26.49,0.000308,180,180,0.006659,2,16/03/2018,29/03/2018,420,180,,Lagon,FS1,FS1_29-03-18.txt,FS1blank_29-03-18.txt,0.006659,7,11:07:01,08:26:01,XS,Reef_services,ok
MOO18-R087,2018-03-29 11:03:40,3,0.0424973284,0.000691033,0.1604783739,0.0415305706,0.1719954119,28.0650884848,0.000166,0.006659,YES,Gnatholepis cauerensis,25.95,20.81,0.000166,180,180,0.006659,3,16/03/2018,29/03/2018,420,180,,Lagon,FS1,FS1_29-03-18.txt,FS1blank_29-03-18.txt,0.006659,7,11:07:01,08:26:01,XS,Reef_services,ok
MOO18-R088,2018-03-29 11:03:40,4,0.0660883767,0.0009821956,0.2156624845,0.0644994097,0.2374775229,28.0639926925,0.000294,0.006659,YES,Gnatholepis cauerensis,32.18,26.5,0.000294,180,180,0.006659,4,16/03/2018,29/03/2018,420,180,,Lagon,FS1,FS1_29-03-18.txt,FS1blank_29-03-18.txt,0.006659,7,11:07:01,08:26:01,XS,Reef_services,ok
MOO18-R089,2018-03-29 11:03:40,5,0.0539657705,0.0010722256,0.1589597237,0.052419536,0.1629700114,28.0131275819,0.000211,0.006659,YES,Gnatholepis cauerensis,28.37,23.46,0.000211,180,180,0.006659,5,16/03/2018,29/03/2018,420,180,,Lagon,FS2,FS2_29-03-18.txt,FS2blank_29-03-18.txt,0.006659,7,11:07:01,08:26:01,XS,Reef_services,ok
MOO18-R090,2018-03-29 11:03:40,6,0.0975169711,0.0013530414,0.2816657032,0.0949439063,0.3581342257,28.0124325461,0.000577,0.006659,YES,Gnatholepis cauerensis,38.22,31.42,0.000577,180,180,0.006659,6,16/03/2018,29/03/2018,420,180,,Lagon,FS2,FS2_29-03-18.txt,FS2blank_29-03-18.txt,0.006659,7,11:07:01,08:26:01,XS,Reef_services,ok
MOO18-R091,2018-04-01 12:18:35,1,0.0300346688,0.0004495163,0.0762030598,0.029612064,0.132073125,28.0411261745,0.000172,0.006659,YES,Asterropteryx semipunctata,24.63,20.14,0.000172,300,180,0.006659,1,NA,01/04/2018,420,180,,Lagon,FS1,FS1_01-04-18.txt,FS1blank_01-04-18.txt,0.006659,8,12:22:01,08:23:01,XS,Reef_services,ok
MOO18-R092,2018-04-01 12:18:35,2,0.0252900218,0.0007349647,0.0822603523,0.0241422404,0.0977217359,28.0410503525,0.000108,0.006659,YES,Asterropteryx semipunctata,21.33,17.3,0.000108,300,180,0.006659,2,NA,01/04/2018,420,180,,Lagon,FS1,FS1_01-04-18.txt,FS1blank_01-04-18.txt,0.006659,8,12:22:01,08:23:01,XS,Reef_services,ok
MOO18-R093,2018-04-01 12:18:35,3,0.0208505308,0.0002406436,0.0663827187,0.020590598,0.0768158885,28.041266785,0.000091,0.006659,YES,Asterropteryx semipunctata,20.41,16.65,0.000091,300,180,0.006659,3,NA,01/04/2018,420,180,,Lagon,FS1,FS1_01-04-18.txt,FS1blank_01-04-18.txt,0.006659,8,12:22:01,08:23:01,XS,Reef_services,ok
MOO18-R094,2018-04-01 12:18:35,4,0.0050638238,0.000231551,0.0202600248,0.0046932887,0.0235764248,28.0416489577,0.000015,0.006659,YES,Asterropteryx semipunctata,11.61,9.73,0.000015,300,180,0.006659,4,NA,01/04/2018,420,180,,Lagon,FS1,FS1_01-04-18.txt,FS1blank_01-04-18.txt,0.006659,8,12:22:01,08:23:01,XS,Reef_services,ok
MOO18-R095,2018-04-01 12:18:35,5,0.0173961988,0.0006866115,0.0524163133,0.0164148388,0.0561707314,27.9891093164,0.000059,0.006659,YES,Asterropteryx semipunctata,18.54,14.99,0.000059,300,180,0.006659,5,NA,01/04/2018,420,180,,Lagon,FS2,FS2_01-04-18.txt,FS2blank_01-04-18.txt,0.006659,8,12:22:01,08:23:01,XS,Reef_services,ok
MOO18-R096,2018-04-01 12:18:35,6,0.0262198252,0.0007128592,0.0591014821,0.024903743,0.0700149706,27.9898903509,0.000065,0.006659,YES,Asterropteryx semipunctata,18.43,14.86,0.000065,300,180,0.006659,6,NA,01/04/2018,420,180,,Lagon,FS2,FS2_01-04-18.txt,FS2blank_01-04-18.txt,0.006659,8,12:22:01,08:23:01,XS,Reef_services,ok
MOO18-R097,2018-04-01 12:18:35,7,0.037654187,0.0006967849,0.0768887318,0.036247454,0.1105115194,27.9897802724,0.000119,0.006659,YES,Asterropteryx semipunctata,21.88,17.91,0.000119,300,180,0.006659,7,NA,01/04/2018,420,180,,Lagon,FS2,FS2_01-04-18.txt,FS2blank_01-04-18.txt,0.006659,8,12:22:01,08:23:01,XS,Reef_services,ok
MOO18-R098,2018-04-02 13:17:51,1,0.0276570259,0.0011657617,0.0952040303,0.0261512131,0.1011160357,28.0444847222,0.000135,0.006659,YES,Asterropteryx semipunctata,23.38,18.64,0.000135,300,180,0.006659,1,NA,02/04/2018,420,180,,Lagon,FS1,FS1_02-04-18.txt,FS1blank_02-04-18.txt,0.006659,8,13:21:01,08:46:01,XS,Reef_services,ok
MOO18-R099,2018-04-02 13:17:51,2,0.0119888617,0.0003071967,0.0312816429,0.0115445798,0.027968392,28.0425385223,0.000038,0.006659,YES,Asterropteryx semipunctata,15.6,12.68,0.000038,300,180,0.006659,2,NA,02/04/2018,420,180,,Lagon,FS1,FS1_02-04-18.txt,FS1blank_02-04-18.txt,0.006659,8,13:21:01,08:46:01,XS,Reef_services,ok
MOO18-R100,2018-04-02 13:17:51,3,0.0139129334,0.000512871,0.042191422,0.0130099377,0.0501007373,28.0426205756,0.000052,0.006659,YES,Asterropteryx semipunctata,16.88,14.24,0.000052,300,180,0.006659,3,NA,02/04/2018,420,180,,Lagon,FS1,FS1_02-04-18.txt,FS1blank_02-04-18.txt,0.006659,8,13:21:01,08:46:01,XS,Reef_services,ok
MOO18-R101,2018-04-02 13:17:51,4,0.0108534186,0.0002122599,0.0239882124,0.0103802737,0.0304564318,28.041475424,0.000024,0.006659,YES,Asterropteryx semipunctata,13.68,10.8,0.000024,300,180,0.006659,4,NA,02/04/2018,420,180,,Lagon,FS1,FS1_02-04-18.txt,FS1blank_02-04-18.txt,0.006659,8,13:21:01,08:46:01,XS,Reef_services,ok
MOO18-R102,2018-04-02 13:17:51,5,0.057670937,0.0009887522,0.1302411639,0.0564160996,0.1767324854,27.988617205,0.000253,0.006659,YES,Asterropteryx semipunctata,27.26,22.06,0.000253,300,180,0.006659,5,NA,02/04/2018,420,180,,Lagon,FS2,FS2_02-04-18.txt,FS2blank_02-04-18.txt,0.006659,8,13:21:01,08:46:01,XS,Reef_services,ok
MOO18-R103,2018-04-02 13:17:51,6,0.035664225,0.0013149804,0.0973207375,0.0338842906,0.1173022898,27.9887841101,0.000137,0.006659,YES,Asterropteryx semipunctata,23.14,18.74,0.000137,300,180,0.006659,6,NA,02/04/2018,420,180,,Lagon,FS2,FS2_02-04-18.txt,FS2blank_02-04-18.txt,0.006659,8,13:21:01,08:46:01,XS,Reef_services,ok
MOO18-R104,2018-04-02 13:17:51,7,0.0503188804,0.0010354505,0.0978926998,0.0489928163,0.1898352137,27.9877403907,0.00028,0.006659,YES,Asterropteryx semipunctata,28.36,23.68,0.00028,300,180,0.006659,7,NA,02/04/2018,420,180,,Lagon,FS2,FS2_02-04-18.txt,FS2blank_02-04-18.txt,0.006659,8,13:21:01,08:46:01,XS,Reef_services,ok
MOO18-R106,2018-06-06 18:17:53,1,2.5313056635,0.0132219811,6.9146580999,2.5161575755,10.1424064556,28.2403731418,0.012917,0.9727,YES,Dascyllus flavicaudus,81,65,0.012917,540,180,0.9727,1,NA,06/06/2018,540,180,,Lagon,FS1,FS1_06-06-18.txt,FS1blank_06-06-18.txt,0.9727,4,18:21:01,NA,M,Reef_services,ok
MOO18-R107,2018-06-06 18:17:53,2,0.7363170116,0.0074210091,2.1200052923,0.7240239377,2.4919617053,28.2383210526,0.003144,0.9727,YES,Dascyllus flavicaudus,51,40,0.003144,540,180,0.9727,2,NA,06/06/2018,540,180,,Lagon,FS1,FS1_06-06-18.txt,FS1blank_06-06-18.txt,0.9727,4,18:21:01,NA,M,Reef_services,ok
MOO18-R122,2018-07-03 10:37:43,1,0.1735693841,0.021190103,0.4860962599,0.1354594947,0.4490219264,29.2948151681,0.001214,0.03329,YES,Fusigobius neophytus,49.8,39,0.001214,420,180,0.03329,1,NA,03/07/2018,420,180,,Lagon,FS1,FS1_03-07-18.txt,FS1blank_03-07-18.txt,0.03857,8,10:40:01,09:28:01,S,Reef_services,ok
MOO18-R123,2018-07-03 10:37:43,2,0.144126236,0.0021393744,0.3611174215,0.1398412319,0.3196624575,29.3017275344,0.001171,0.03404,YES,Fusigobius neophytus,49.4,39,0.001171,420,180,0.03404,2,NA,03/07/2018,420,180,,Lagon,FS1,FS1_03-07-18.txt,FS1blank_03-07-18.txt,0.03857,8,10:40:01,09:28:01,S,Reef_services,ok
MOO18-R124,2018-07-03 10:37:43,3,0.1362391988,0.002045289,0.372577236,0.1328465787,0.3187000741,29.3084056716,0.001166,0.0348,YES,Fusigobius neophytus,49.9,38.8,0.001166,420,180,0.0348,3,NA,03/07/2018,420,180,,Lagon,FS1,FS1_03-07-18.txt,FS1blank_03-07-18.txt,0.03857,8,10:40:01,09:28:01,S,Reef_services,ok
MOO18-R125,2018-07-03 10:37:43,4,0.160296454,0.0019517033,0.3187539026,0.1575445273,0.4034909636,29.3147758539,0.001206,0.03555,YES,Fusigobius neophytus,50,39.4,0.001206,420,180,0.03555,4,NA,03/07/2018,420,180,,Lagon,FS1,FS1_03-07-18.txt,FS1blank_03-07-18.txt,0.03857,8,10:40:01,09:28:01,S,Reef_services,ok
MOO18-R126,2018-07-03 10:37:43,5,0.1759311841,0.0004400627,0.3812712059,0.1750640978,0.5117306587,29.2712816527,0.001697,0.03631,YES,Fusigobius neophytus,57.1,44,0.001697,420,180,0.03631,5,NA,03/07/2018,420,180,,Lagon,FS2,FS2_03-07-18.txt,FS2blank_03-07-18.txt,0.03857,8,10:40:01,09:28:01,S,Reef_services,ok
MOO18-R127,2018-07-03 10:37:43,6,0.298050216,0.0046199835,0.8346640105,0.2867805595,0.7309470479,29.2771422304,0.001999,0.03706,YES,Gnatholepis cauerensis,60,47.6,0.001999,420,180,0.03706,6,NA,03/07/2018,420,180,,Lagon,FS2,FS2_03-07-18.txt,FS2blank_03-07-18.txt,0.03857,8,10:40:01,09:28:01,S,Reef_services,ok
MOO18-R128,2018-07-03 10:37:43,7,0.1601843523,0.0055163744,0.4628335853,0.1522590142,0.4972917931,29.2827983201,0.000927,0.03782,YES,Gnatholepis cauerensis,46.2,36.9,0.000927,420,180,0.03782,7,NA,03/07/2018,420,180,,Lagon,FS2,FS2_03-07-18.txt,FS2blank_03-07-18.txt,0.03857,8,10:40:01,09:28:01,S,Reef_services,ok
MOO18-R129,2018-07-04 11:53:11,1,0.1071608067,0.0028223787,0.3780892598,0.1022856411,0.3688979281,28.7032296471,0.000526,0.006659,YES,Gnatholepis cauerensis,39,31,0.000526,120,180,0.006659,1,NA,04/07/2018,420,180,,Lagon,FS1,FS1_04-07-18.txt,FS1blank_04-07-18.txt,0.006659,8,11:56:01,09:28:01,XS,Reef_services,ok
MOO18-R130,2018-07-04 11:53:11,2,0.0750041685,0.0013369712,0.3470222805,0.0727600067,0.3509976442,28.7007699213,0.000465,0.006659,YES,Gnatholepis cauerensis,37.1,29.9,0.000465,120,180,0.006659,2,NA,04/07/2018,420,180,,Lagon,FS1,FS1_04-07-18.txt,FS1blank_04-07-18.txt,0.006659,8,11:56:01,09:28:01,XS,Reef_services,ok
MOO18-R131,2018-07-04 11:53:11,3,0.1483937252,0.00673954,0.4458968207,0.1327520032,0.3530641589,28.6982983399,0.000817,0.006659,YES,Gnatholepis cauerensis,44,34.9,0.000817,120,180,0.006659,3,NA,04/07/2018,420,180,,Lagon,FS1,FS1_04-07-18.txt,FS1blank_04-07-18.txt,0.006659,8,11:56:01,09:28:01,XS,Reef_services,ok
MOO18-R132,2018-07-04 11:53:11,4,0.109306942,0.0011918241,0.2521959375,0.107123605,0.2467184281,28.6960195238,0.000803,0.006659,YES,Fusigobius neophytus,43,36,0.000803,120,180,0.006659,4,NA,04/07/2018,420,180,,Lagon,FS1,FS1_04-07-18.txt,FS1blank_04-07-18.txt,0.006659,8,11:56:01,09:28:01,XS,Reef_services,ok
MOO18-R133,2018-07-04 11:53:11,5,0.1010608972,0.0018379093,0.239838532,0.0981646754,0.2630344431,28.6348789841,0.000687,0.006659,YES,Fusigobius neophytus,42.5,33.1,0.000687,120,180,0.006659,5,NA,04/07/2018,420,180,,Lagon,FS2,FS2_04-07-18.txt,FS2blank_04-07-18.txt,0.006659,8,11:56:01,09:28:01,XS,Reef_services,ok
MOO18-R134,2018-07-04 11:53:11,6,0.0801506083,0.0017733826,0.3323971747,0.0774575961,0.215988373,28.6323098333,0.000385,0.006659,YES,Gnatholepis cauerensis,34.1,27,0.000385,120,180,0.006659,6,NA,04/07/2018,420,180,,Lagon,FS2,FS2_04-07-18.txt,FS2blank_04-07-18.txt,0.006659,8,11:56:01,09:28:01,XS,Reef_services,ok
MOO18-R135,2018-07-04 11:53:11,7,0.1014204232,0.0034359222,0.231138936,0.0959796856,0.251228228,28.6296999665,0.000564,0.006659,YES,Fusigobius neophytus,39,31,0.000564,120,180,0.006659,7,NA,04/07/2018,420,180,,Lagon,FS2,FS2_04-07-18.txt,FS2blank_04-07-18.txt,0.006659,8,11:56:01,09:28:01,XS,Reef_services,ok
MOO18-R136,2018-07-05 12:14:09,1,0.0620073882,0.0010840949,0.1965591796,0.0602746044,0.2224478644,28.258947861,0.000276,0.006659,YES,Gnatholepis cauerensis,31.3,25,0.000276,180,180,0.006659,1,NA,05/07/2018,420,180,,Lagon,FS1,FS1_05-07-18.txt,FS1blank_05-07-18.txt,0.006659,8,12:17:01,08:53:01,XS,Reef_services,ok
MOO18-R137,2018-07-05 12:14:09,2,0.0592666157,0.0010835896,0.2007881809,0.0576076193,0.2192600346,28.2573668607,0.000228,0.006659,YES,Gnatholepis cauerensis,30,23.1,0.000228,180,180,0.006659,2,NA,05/07/2018,420,180,,Lagon,FS1,FS1_05-07-18.txt,FS1blank_05-07-18.txt,0.006659,8,12:17:01,08:53:01,XS,Reef_services,ok
MOO18-R138,2018-07-05 12:14:09,3,0.0688440535,0.0005363823,0.1643844986,0.0675390954,-0.2602589786,28.2556551755,0.000224,0.006659,YES,Gnatholepis cauerensis,29.2,23,0.000224,180,180,0.006659,3,NA,05/07/2018,420,180,,Lagon,FS1,FS1_05-07-18.txt,FS1blank_05-07-18.txt,0.006659,8,12:17:01,08:53:01,XS,Reef_services,ok
MOO18-R139,2018-07-05 12:14:09,4,0.1030787409,0.0012608516,0.2127423251,0.1010659322,0.2071709868,28.2539142469,0.000603,0.006659,YES,Fusigobius neophytus,39.1,33,0.000603,180,180,0.006659,4,NA,05/07/2018,420,180,,Lagon,FS1,FS1_05-07-18.txt,FS1blank_05-07-18.txt,0.006659,8,12:17:01,08:53:01,XS,Reef_services,ok
MOO18-R140,2018-07-05 12:14:09,5,0.0801084985,0.0012628738,0.2511263055,0.0782893246,0.246729154,28.2145423148,0.000446,0.006659,YES,Gnatholepis cauerensis,36,29.2,0.000446,180,180,0.006659,5,NA,05/07/2018,420,180,,Lagon,FS2,FS2_05-07-18.txt,FS2blank_05-07-18.txt,0.006659,8,12:17:01,08:53:01,XS,Reef_services,ok
MOO18-R141,2018-07-05 12:14:09,6,0.0655807877,0.0011328836,0.206406073,0.063797348,0.2304280132,28.2124413735,0.000264,0.006659,YES,Gnatholepis cauerensis,32.8,25,0.000264,180,180,0.006659,6,NA,05/07/2018,420,180,,Lagon,FS2,FS2_05-07-18.txt,FS2blank_05-07-18.txt,0.006659,8,12:17:01,08:53:01,XS,Reef_services,ok
MOO18-R142,2018-07-05 12:14:09,7,0.0668983061,0.0007895251,0.1371652597,0.0658371229,0.1081635371,28.2104358399,0.000322,0.006659,YES,Fusigobius neophytus,33,26,0.000322,180,180,0.006659,7,NA,05/07/2018,420,180,,Lagon,FS2,FS2_05-07-18.txt,FS2blank_05-07-18.txt,0.006659,8,12:17:01,08:53:01,XS,Reef_services,ok
MOO18-R143,2018-07-10 08:28:57,1,0.0482548169,0.0006515764,0.1132885729,0.0471964749,0.1190442297,27.8734688129,0.000349,0.006659,YES,Fusigobius neophytus,33.6,27.1,0.000349,420,180,0.006659,1,NA,10/07/2018,420,180,,Lagon,FS1,FS1_10-07-18.txt,FS1blank_10-07-18.txt,0.006659,8,08:32:01,08:27:01,XS,Reef_services,ok
MOO18-R144,2018-07-10 08:28:57,2,0.0411246799,0.0006121097,0.0900235139,0.0404143778,0.0508210022,27.8735983384,0.000163,0.006659,YES,Gnatholepis cauerensis,27.2,21.6,0.000163,420,180,0.006659,2,NA,10/07/2018,420,180,,Lagon,FS1,FS1_10-07-18.txt,FS1blank_10-07-18.txt,0.006659,8,08:32:01,08:27:01,XS,Reef_services,ok
MOO18-R145,2018-07-10 08:28:57,3,0.0713560499,0.0012175188,0.1176114913,0.0695567061,0.174553368,27.8738258367,0.00022,0.006659,YES,Gnatholepis cauerensis,30,23,0.00022,420,180,0.006659,3,NA,10/07/2018,420,180,,Lagon,FS1,FS1_10-07-18.txt,FS1blank_10-07-18.txt,0.006659,8,08:32:01,08:27:01,XS,Reef_services,ok
MOO18-R146,2018-07-10 08:28:57,4,0.0491627038,0.0005843509,0.1071592148,0.0482468622,0.1374270676,27.8742862898,0.000136,0.006659,YES,Gnatholepis cauerensis,25.2,19.9,0.000136,420,180,0.006659,4,NA,10/07/2018,420,180,,Lagon,FS1,FS1_10-07-18.txt,FS1blank_10-07-18.txt,0.006659,8,08:32:01,08:27:01,XS,Reef_services,ok
MOO18-R147,2018-07-10 08:28:57,5,0.0407712758,0.0005616504,0.0840936455,0.0396721078,0.1038354992,27.8269840994,0.000232,0.006659,YES,Fusigobius neophytus,31,24.5,0.000232,420,180,0.006659,5,NA,10/07/2018,420,180,,Lagon,FS2,FS2_10-07-18.txt,FS2blank_10-07-18.txt,0.006659,8,08:32:01,08:27:01,XS,Reef_services,ok
MOO18-R148,2018-07-10 08:28:57,6,NA,NA,NA,Inf,NA,27.8273710532,NA,0.006659,YES,Fusigobius neophytus,19,16,NA,420,180,0.006659,6,NA,10/07/2018,420,180,,Lagon,FS2,FS2_10-07-18.txt,FS2blank_10-07-18.txt,0.006659,8,08:32:01,08:27:01,XS,Reef_services,ok
MOO18-R149,2018-07-10 08:28:57,7,NA,NA,NA,Inf,NA,27.8276721008,NA,0.006659,YES,Gnatholepis cauerensis,28.1,23,NA,420,180,0.006659,7,NA,10/07/2018,420,180,,Lagon,FS2,FS2_10-07-18.txt,FS2blank_10-07-18.txt,0.006659,8,08:32:01,08:27:01,XS,Reef_services,ok
MOO18-R150,2018-07-11 10:31:00,1,0.0467576324,0.0004891135,0.1079557935,0.0457891845,0.1731119607,25.2839331298,0.000258,0.006659,YES,Gnatholepis cauerensis,30.6,29.1,0.000258,420,180,0.006659,1,NA,11/07/2018,420,180,,Lagon,FS1,FS1_11-07-18.txt,FS1blank_11-07-18.txt,0.006659,3,10:32:01,08:34:01,XS,Reef_services,ok
MOO18-R151,2018-07-11 10:31:00,2,0.0339421012,0.0003840608,0.0791077297,0.0335386259,0.0949946671,25.2651834725,0.000239,0.006659,YES,Fusigobius neophytus,30.2,29,0.000239,420,180,0.006659,2,NA,11/07/2018,420,180,,Lagon,FS1,FS1_11-07-18.txt,FS1blank_11-07-18.txt,0.006659,3,10:32:01,08:34:01,XS,Reef_services,ok
MOO18-R152,2018-07-12 13:32:32,1,0.1304644169,0.0013289676,0.3507845889,0.1285090132,0.386290089,27.7334289165,0.001032,0.03329,YES,Fusigobius neophytus,47.2,37,0.001032,720,180,0.03329,1,NA,12/07/2018,720,180,,Lagon,FS1,FS1_12-07-18.txt,FS1blank_12-07-18.txt,0.03631,5,13:34:01,13:04:01,S,Reef_services,ok
MOO18-R153,2018-07-12 13:32:32,2,0.119990396,0.0019740156,0.3710753241,0.1174445183,0.3308781993,27.7458992642,0.000988,0.03404,YES,Fusigobius neophytus,46.2,37,0.000988,720,180,0.03404,2,NA,12/07/2018,720,180,,Lagon,FS1,FS1_12-07-18.txt,FS1blank_12-07-18.txt,0.03631,5,13:34:01,13:04:01,S,Reef_services,ok
MOO18-R154,2018-07-12 13:32:32,3,0.1288122503,0.0038088876,0.1899808741,0.1252296931,0.2686108271,27.7598278614,0.001424,0.0348,YES,Fusigobius neophytus,51,40.9,0.001424,720,180,0.0348,3,NA,12/07/2018,720,180,,Lagon,FS1,FS1_12-07-18.txt,FS1blank_12-07-18.txt,0.03631,5,13:34:01,13:04:01,S,Reef_services,ok
MOO18-R155,2018-07-12 13:32:32,4,0.1042139382,0.0010238889,0.2598400861,0.1027755807,0.3819230831,27.7751311111,0.000883,0.03555,YES,Gnatholepis cauerensis,48,36.9,0.000883,720,180,0.03555,4,NA,12/07/2018,720,180,,Lagon,FS1,FS1_12-07-18.txt,FS1blank_12-07-18.txt,0.03631,5,13:34:01,13:04:01,S,Reef_services,ok
MOO18-R156,2018-07-18 14:26:44,1,9.6492716238,0.2665031828,21.8417521452,9.3153275972,14.9214028753,28.2740902962,0.07812,0.9727,YES,Zebrasoma scopas,158,131,0.07812,300,180,0.9727,1,NA,18/07/2018,420,180,,Lagon,FS1,FS1_18-07-18.txt,FS1blank_18-07-18.txt,0.9727,4,14:28:01,09:13:01,M,Reef_services,ok
MOO18-R157,2018-07-18 14:26:44,2,7.2161320492,0.1102604322,19.1573129142,7.0418643703,18.9625951788,28.2713391304,0.06771,0.9727,YES,Zebrasoma scopas,141,123,0.06771,300,180,0.9727,2,NA,18/07/2018,420,180,,Lagon,FS1,FS1_18-07-18.txt,FS1blank_18-07-18.txt,0.9727,4,14:28:01,09:13:01,M,Reef_services,ok
MOO18-R158,2018-07-18 14:26:44,3,6.9219869007,0.0504439516,20.5212401884,6.8385532569,22.6646929714,28.2689315217,0.057,0.9727,YES,Zebrasoma scopas,137,114,0.057,300,180,0.9727,3,NA,18/07/2018,420,180,,Lagon,FS1,FS1_18-07-18.txt,FS1blank_18-07-18.txt,0.9727,4,14:28:01,09:13:01,M,Reef_services,ok
MOO18-R159,2018-07-19 11:56:21,1,4.6762083003,0.012265064,17.1792710989,4.661092846,17.4488960049,28.6047876812,0.0603,0.9727,NO,Zebrasoma scopas,146,123,0.0603,300,300,0.9727,1,NA,19/07/2018,420,180,,Lagon,FS1,FS1_19-07-18.txt,FS1blank_19-07-18.txt,0.9727,4,11:57:01,08:43:01,M,Reef_services,ok
MOO18-R160,2018-07-19 11:56:21,2,12.4674063098,0.2713726969,22.8485515086,11.983667476,28.2673772891,28.6037589331,0.0925,0.9727,NO,Zebrasoma scopas,165,139,0.0925,300,300,0.9727,2,NA,19/07/2018,420,180,,Lagon,FS1,FS1_19-07-18.txt,FS1blank_19-07-18.txt,0.9727,4,11:57:01,08:43:01,M,Reef_services,ok
MOO18-R161,2018-07-19 11:56:21,3,7.7183027543,0.1205387938,16.3168258064,7.5337325703,12.7295793672,28.602593073,0.0598,0.9727,NO,Zebrasoma scopas,138,117,0.0598,300,300,0.9727,3,NA,19/07/2018,420,180,,Lagon,FS1,FS1_19-07-18.txt,FS1blank_19-07-18.txt,0.9727,4,11:57:01,08:43:01,M,Reef_services,ok
MOO18-R162,2018-07-26 15:06:49,1,5.1057312491,0.1948956038,30.684150242,4.8219757168,29.5426259441,28.6626133688,0.1109,0.9727,YES,Epinephelus merra,200,172,0.1109,300,300,0.9727,1,NA,26/07/2018,420,180,,Lagon,FS3,FS3_26-07-18.txt,FS3blank_26-07-18.txt,0.9727,4,15:10:01,15:52:01,M,Reef_services,ok
MOO18-R163,2018-07-26 15:06:49,2,6.2849039195,0.1583753771,30.1143894934,6.0751866676,31.0412131441,28.6600860631,0.0802,0.9727,YES,Epinephelus merra,187,162,0.0802,300,300,0.9727,2,NA,26/07/2018,420,180,,Lagon,FS3,FS3_26-07-18.txt,FS3blank_26-07-18.txt,0.9727,4,15:10:01,15:52:01,M,Reef_services,ok
MOO18-R164,2018-07-26 15:06:49,3,2.7055860829,0.1138670012,9.0599995024,2.5147190991,9.9510559297,28.6575276762,0.03565,0.9727,YES,Pterois radiata,134,101,0.03565,300,300,0.9727,3,NA,26/07/2018,420,180,,Lagon,FS3,FS3_26-07-18.txt,FS3blank_26-07-18.txt,0.9727,4,15:10:01,15:52:01,M,Reef_services,ok
MOO18-R165,2018-08-16 12:48:16,1,0.6572932288,0.0107911438,2.0251310321,0.6375207012,2.2161476369,27.6836461039,0.005295,0.03329,YES,Canthigaster janthinoptera,60,47,0.005295,180,180,0.03329,1,14/08/2018,16/08/2018,420,180,,Lagon,FS1,FS1_16-08-18.txt,FS1blank_16-08-18.txt,0.03857,8,12:53:01,08:39:01,S,Reef_services,ok
MOO18-R166,2018-08-16 12:48:16,2,0.3824292426,0.0065353796,1.5346718161,0.3692313143,1.4581331443,27.679489697,0.003587,0.03404,YES,Canthigaster janthinoptera,53,41,0.003587,180,180,0.03404,2,14/08/2018,16/08/2018,420,180,,Lagon,FS1,FS1_16-08-18.txt,FS1blank_16-08-18.txt,0.03857,8,12:53:01,08:39:01,S,Reef_services,ok
MOO18-R167,2018-08-16 12:48:16,3,0.6718375254,0.0129465231,1.7644986615,0.6460597207,1.4741246843,27.6750864105,0.001574,0.0348,YES,Dascyllus flavicaudus,39,30,0.001574,180,180,0.0348,3,15/08/2018,16/08/2018,420,180,,Lagon,FS1,FS1_16-08-18.txt,FS1blank_16-08-18.txt,0.03857,8,12:53:01,08:39:01,S,Reef_services,ok
MOO18-R168,2018-08-16 12:48:16,4,0.1408186538,0.0027015564,0.2908895127,0.1367939051,0.2424141269,27.6711020254,0.000277,0.03555,YES,Dascyllus flavicaudus,21,16,0.000277,180,180,0.03555,4,15/08/2018,16/08/2018,420,180,,Lagon,FS1,FS1_16-08-18.txt,FS1blank_16-08-18.txt,0.03857,8,12:53:01,08:39:01,S,Reef_services,ok
MOO18-R169,2018-08-16 12:48:16,5,0.1111866473,0.0030384192,0.2817598189,0.1070690374,0.4790668352,27.7630033758,0.00021,0.03631,YES,Dascyllus flavicaudus,19,15,0.00021,180,180,0.03631,5,15/08/2018,16/08/2018,420,180,,Lagon,FS2,FS2_16-08-18.txt,FS2blank_16-08-18.txt,0.03857,8,12:53:01,08:39:01,S,Reef_services,ok
MOO18-R170,2018-08-16 12:48:16,6,0.1483995302,0.0039861014,0.412347347,0.1403535549,0.0417275168,27.7590411092,0.000587,0.03706,YES,Dascyllus flavicaudus,29,23,0.000587,180,180,0.03706,6,15/08/2018,16/08/2018,420,180,,Lagon,FS2,FS2_16-08-18.txt,FS2blank_16-08-18.txt,0.03857,8,12:53:01,08:39:01,S,Reef_services,ok
MOO18-R171,2018-08-16 12:48:16,7,0.2443874428,0.0055799995,0.4937189159,0.2363043107,0.5186144762,27.7547753411,0.000279,0.03782,YES,Dascyllus flavicaudus,22,17,0.000279,180,180,0.03782,7,15/08/2018,16/08/2018,420,180,,Lagon,FS2,FS2_16-08-18.txt,FS2blank_16-08-18.txt,0.03857,8,12:53:01,08:39:01,S,Reef_services,ok
MOO18-R172,2018-08-16 13:43:58,1,7.1851600573,0.1885938075,21.999969949,6.9339514638,21.8855920627,27.8379631206,0.07097,0.9727,YES,Zebrasoma scopas,149,125,0.07097,300,180,0.9727,1,14/08/2018,16/08/2018,420,180,,Lagon,FS3,FS3_16-08-18.txt,FS3blank_16-08-18.txt,0.9727,4,13:47:01,08:56:01,M,Reef_services,ok
MOO18-R173,2018-08-16 13:43:58,2,9.7764639452,0.3380453185,23.0082154955,9.3356106534,24.645684823,27.8306647205,0.0642,0.9727,YES,Sargocentron microstoma,164,143,0.0642,300,180,0.9727,2,14/08/2018,16/08/2018,420,180,,Lagon,FS3,FS3_16-08-18.txt,FS3blank_16-08-18.txt,0.9727,4,13:47:01,08:56:01,M,Reef_services,ok
MOO18-R174,2018-08-16 13:43:58,3,6.9738066981,0.0848991628,16.8805007414,6.8235623186,17.0759643589,27.8231245543,0.04498,0.9727,YES,Ctenochaetus striatus,146,106,0.04498,300,180,0.9727,3,14/08/2018,16/08/2018,420,180,,Lagon,FS3,FS3_16-08-18.txt,FS3blank_16-08-18.txt,0.9727,4,13:47:01,08:56:01,M,Reef_services,ok
MOO18-R175,2018-08-16 14:06:45,1,12.3436631324,0.2850573585,37.8751225257,11.9468993057,45.5214521288,27.7043619876,0.1108,4.4,YES,Sargocentron caudimaculatum,180,155,0.1108,420,300,4.4,1,14/08/2018,16/08/2018,420,180,,Lagon,FS4,FS4_16-08-18.txt,FS4blank_16-08-18.txt,4.4,4,14:10:01,08:57:01,L,Reef_services,ok
MOO18-R176,2018-08-16 14:06:45,2,11.1205884222,0.2024664899,24.6732217476,10.8955575149,27.271124192,27.693197551,0.1084,4.4,YES,Sargocentron caudimaculatum,180,153,0.1084,420,300,4.4,2,14/08/2018,16/08/2018,420,180,,Lagon,FS4,FS4_16-08-18.txt,FS4blank_16-08-18.txt,4.4,4,14:10:01,08:57:01,L,Reef_services,ok
MOO18-R177,2018-08-16 14:06:45,3,19.3940629885,0.2300476902,47.1697991387,18.8873100365,48.9305912076,27.6817400635,0.11955,4.4,YES,Ctenochaetus striatus,195,145,0.11955,420,300,4.4,3,14/08/2018,16/08/2018,420,180,,Lagon,FS4,FS4_16-08-18.txt,FS4blank_16-08-18.txt,4.4,4,14:10:01,08:57:01,L,Reef_services,ok
MOO18-R178,2018-08-17 13:00:07,1,1.2066824303,0.0311518947,4.089031038,1.1591715568,2.7532721571,28.1089843103,0.00716,0.03329,YES,Istiblennius edentulus,90,73,0.00716,120,180,0.03329,1,NA,17/08/2018,420,180,,Lagon,FS1,FS1_17-08-18.txt,FS1blank_17-08-18.txt,0.03631,5,13:03:01,NA,S,Reef_services,ok
MOO18-R179,2018-08-17 13:00:07,2,0.2236468042,0.0174702673,1.6493925115,0.2007276715,1.4229777363,28.1078419048,0.002865,0.03404,YES,Halichoeres marginatus,63,53,0.002865,120,180,0.03404,2,16/08/2018,17/08/2018,420,180,,Lagon,FS1,FS1_17-08-18.txt,FS1blank_17-08-18.txt,0.03631,5,13:03:01,NA,S,Reef_services,ok
MOO18-R180,2018-08-17 13:00:07,3,0.5063493916,0.0141306015,1.6887526006,0.477969315,0.8759250989,28.1066033043,0.00408,0.0348,YES,Neocirrhites armatus,59,51,0.00408,120,180,0.0348,3,16/08/2018,17/08/2018,420,180,,Lagon,FS1,FS1_17-08-18.txt,FS1blank_17-08-18.txt,0.03631,5,13:03:01,NA,S,Reef_services,ok
MOO18-R181,2018-08-17 13:00:07,4,0.3904874212,0.0241301105,1.46619396,0.3397009152,0.0506326154,28.1052024454,0.0029,0.03555,YES,Neocirrhites armatus,55,48,0.0029,120,180,0.03555,4,16/08/2018,17/08/2018,420,180,,Lagon,FS1,FS1_17-08-18.txt,FS1blank_17-08-18.txt,0.03631,5,13:03:01,NA,S,Reef_services,ok
MOO18-R182,2018-08-17 14:12:23,1,7.8923658646,0.4041031082,29.5198473886,7.2772020794,31.0379415869,28.2699757537,0.0728,0.9727,YES,Myripristis berndti,160,126,0.0728,300,180,0.9727,1,15/08/2018,17/08/2018,420,180,Blank 7/2__?,Lagon,FS3,FS3_17-08-18.txt,FS3blank_17-08-18.txt,0.9727,4,14:31:01,08:42:07,M,Reef_services,ok
MOO18-R183,2018-08-17 14:12:23,2,7.0508557475,0.072317196,21.7642448367,6.9096189024,24.3077850457,28.2653445013,0.06045,0.9727,YES,Zebrasoma scopas,136,110,0.06045,300,180,0.9727,2,15/08/2018,17/08/2018,420,180,,Lagon,FS3,FS3_17-08-18.txt,FS3blank_17-08-18.txt,0.9727,4,14:31:01,08:42:07,M,Reef_services,ok
MOO18-R184,2018-08-17 14:12:23,3,2.7263203215,0.0560989527,31.7168171217,2.6570489937,5.4751661116,28.2602224799,0.03125,0.9727,YES,Pterois radiata,116,98,0.03125,300,180,0.9727,3,15/08/2018,17/08/2018,420,180,,Lagon,FS3,FS3_17-08-18.txt,FS3blank_17-08-18.txt,0.9727,4,14:31:01,08:42:07,M,Reef_services,ok
MOO18-R185,2018-08-17 14:40:45,1,35.7051263636,0.6237463209,165.8963064935,34.8590754545,171.2486142857,27.8829087542,0.59,4.4,NO,Cephalopholis argus,329,272,0.59,180,420,4.4,1,15/08/2018,17/08/2018,420,180,,Lagon,FS4,FS4_17-08-18.txt,FS4blank_17-08-18.txt,4.4,4,14:43:01,NA,L,Reef_services,ok
MOO18-R186,2018-08-17 14:40:45,2,23.2316663822,0.3646707496,99.6009502597,22.7267816883,115.3929310345,27.8761063721,0.47,4.4,NO,Ephibulus insidiator,306,230,0.47,180,420,4.4,2,14/08/2018,17/08/2018,420,180,,Lagon,FS4,FS4_17-08-18.txt,FS4blank_17-08-18.txt,4.4,4,14:43:01,NA,L,Reef_services,ok
MOO18-R187,2018-08-17 14:40:45,3,8.0793249403,0.4048459961,76.3921431182,7.4457065091,71.6167228276,27.868361235,0.1741,4.4,NO,Odonus niger,260,165,0.1741,180,420,4.4,3,15/08/2018,17/08/2018,420,180,,Lagon,FS4,FS4_17-08-18.txt,FS4blank_17-08-18.txt,4.4,4,14:43:01,NA,L,Reef_services,ok
MOO18-R188,2018-08-21 09:45:23,1,0.3216437421,0.0134696524,1.3810308726,0.2958618551,0.8709157374,27.5700518276,0.003488,0.03329,YES,Halichoeres trimaculatus,69,55,0.003488,180,240,0.03329,1,20/08/2018,21/08/2018,420,180,,Lagon,FS1,FS1_21-08-18.txt,FS1blank_21-08-18.txt,0.03857,8,09:48:01,08:37:01,S,Reef_services,ok
MOO18-R189,2018-08-21 09:45:23,2,0.7635639377,0.0047697853,1.2654372611,0.7581056834,1.3278804409,27.5685479039,0.00249,0.03404,YES,Pomacentrus pavo,56,42,0.00249,180,240,0.03404,2,20/08/2018,21/08/2018,420,180,,Lagon,FS1,FS1_21-08-18.txt,FS1blank_21-08-18.txt,0.03857,8,09:48:01,08:37:01,S,Reef_services,ok
MOO18-R190,2018-08-21 09:45:23,3,0.5594352948,0.0057144225,0.8741599875,0.5502720053,1.1142230532,27.5676462121,0.002035,0.0348,YES,Pomacentrus pavo,45,40,0.002035,180,240,0.0348,3,20/08/2018,21/08/2018,420,180,,Lagon,FS1,FS1_21-08-18.txt,FS1blank_21-08-18.txt,0.03857,8,09:48:01,08:37:01,S,Reef_services,ok
MOO18-R191,2018-08-21 09:45:23,4,0.3645979781,0.004622371,0.7766060659,0.3570876563,0.9303754581,27.5668243693,0.001275,0.03555,YES,Pomacentrus pavo,45,33,0.001275,180,240,0.03555,4,20/08/2018,21/08/2018,420,180,,Lagon,FS1,FS1_21-08-18.txt,FS1blank_21-08-18.txt,0.03857,8,09:48:01,08:37:01,S,Reef_services,ok
MOO18-R192,2018-08-21 09:45:23,5,0.1967047066,0.0032976503,0.3620140255,0.1919460632,0.3827134862,27.5857414354,0.000357,0.03631,YES,Pomacentrus pavo,25,23,0.000357,180,240,0.03631,5,20/08/2018,21/08/2018,420,180,,Lagon,FS2,FS2_21-08-18.txt,FS2blank_21-08-18.txt,0.03857,8,09:48:01,08:37:01,S,Reef_services,ok
MOO18-R193,2018-08-21 09:45:23,6,0.3349668856,0.0070920564,0.8835772583,0.3210948973,0.6501717858,27.58463367,0.001832,0.03706,YES,Chrysiptera brownriggii,47,38,0.001832,180,240,0.03706,6,20/08/2018,21/08/2018,420,180,,Lagon,FS2,FS2_21-08-18.txt,FS2blank_21-08-18.txt,0.03857,8,09:48:01,08:37:01,S,Reef_services,ok
MOO18-R194,2018-08-21 09:45:23,7,0.3939715157,0.0061121868,1.2332947905,0.3822564338,1.190254919,27.583372824,0.000965,0.03782,YES,Chaetodon citrinellus,36,30,0.000965,180,240,0.03782,7,20/08/2018,21/08/2018,420,180,,Lagon,FS2,FS2_21-08-18.txt,FS2blank_21-08-18.txt,0.03857,8,09:48:01,08:37:01,S,Reef_services,ok
MOO18-R195,2018-08-21 10:43:20,1,1.6067502838,0.0178382238,3.818247417,1.5748132247,4.6987389891,27.6996324178,0.009765,0.9727,YES,Centropyge flavissima,75,59,0.009765,540,180,0.9727,1,20/08/2018,21/08/2018,420,180,,Lagon,FS3,FS3_21-08-18.txt,FS3blank_21-08-18.txt,0.9727,4,10:45:01,08:51:00,M,Reef_services,ok
MOO18-R196,2018-08-21 10:43:20,2,2.0803752333,0.0530030677,5.9875441598,2.0016937445,6.4840373169,27.69868374,0.010806,0.9727,YES,Centropyge flavissima,78,62,0.010806,540,180,0.9727,2,16/08/2108,21/08/2018,420,180,,Lagon,FS3,FS3_21-08-18.txt,FS3blank_21-08-18.txt,0.9727,4,10:45:01,08:51:00,M,Reef_services,ok
MOO18-R197,2018-08-21 10:43:20,3,0.9888219638,0.0138324542,3.6317602692,0.9690174736,3.411654946,27.6975954689,0.005826,0.9727,YES,Centropyge flavissima,65,53,0.005826,540,180,0.9727,3,16/08/2108,21/08/2018,420,180,,Lagon,FS3,FS3_21-08-18.txt,FS3blank_21-08-18.txt,0.9727,4,10:45:01,08:51:00,M,Reef_services,ok
MOO18-R198,2018-08-21 11:10:28,1,21.4731720121,0.1853240736,62.8495435663,21.1914158469,66.7438004234,27.8125081976,0.1513,4.4,YES,Ctenochaetus striatus,230,175,0.1513,420,300,4.4,1,20/08/2018,21/08/2018,420,180,,Lagon,FS4,FS4_21-08-18.txt,FS4blank_21-08-18.txt,4.4,4,11:13:01,08:53:00,L,Reef_services,ok
MOO18-R199,2018-08-21 11:10:28,2,13.9201864957,0.2224579731,32.8109964802,13.6604395939,54.9389116755,27.8105127763,0.1172,4.4,YES,Myripristis berndti,195,160,0.1172,420,300,4.4,2,15/08/2018,21/08/2018,420,180,,Lagon,FS4,FS4_21-08-18.txt,FS4blank_21-08-18.txt,4.4,4,11:13:01,08:53:00,L,Reef_services,ok
MOO18-R200,2018-08-21 11:10:28,3,4.1366958937,0.1242245979,67.3100717672,3.9889418006,14.0763880625,27.8087669116,0.082723,4.4,YES,Pterois radiata,165,130,0.082723,420,300,4.4,3,15/08/2018,21/08/2018,420,180,,Lagon,FS4,FS4_21-08-18.txt,FS4blank_21-08-18.txt,4.4,4,11:13:01,08:53:00,L,Reef_services,ok
MOO18-R201,2018-08-22 12:03:23,1,0.740037848,0.0117547257,1.7376757056,0.7189066446,1.967932376,27.5636054443,0.003474,0.03329,YES,Pomacentrus pavo,65,49,0.003474,180,240,0.03329,1,20/08/2018,22/08/2018,420,180,,Lagon,FS1,FS1_22-08-18.txt,FS1blank_22-08-18.txt,0.03857,8,12:06:01,09:11:01,S,Reef_services,ok
MOO18-R202,2018-08-22 12:03:23,2,1.0572620848,0.0165781564,2.1974338975,1.0312932018,2.1855011727,27.5617619835,0.004625,0.03404,YES,Pomacentrus pavo,70,52,0.004625,180,240,0.03404,2,20/08/2018,22/08/2018,420,180,,Lagon,FS1,FS1_22-08-18.txt,FS1blank_22-08-18.txt,0.03857,8,12:06:01,09:11:01,S,Reef_services,ok
MOO18-R203,2018-08-22 12:03:23,3,0.4915960395,0.0095418116,1.2516062763,0.4768619435,2.2380456721,27.5579075325,0.001812,0.0348,YES,Pomacentrus pavo,53,38,0.001812,180,240,0.0348,3,20/08/2018,22/08/2018,420,180,,Lagon,FS1,FS1_22-08-18.txt,FS1blank_22-08-18.txt,0.03857,8,12:06:01,09:11:01,S,Reef_services,ok
MOO18-R204,2018-08-22 12:03:23,4,0.4365626078,0.0109285235,1.639274933,0.4148933825,1.7366897305,27.5534585162,0.00306,0.03555,YES,Canthigaster janthinoptera,52,41,0.00306,180,240,0.03555,4,21/08/2018,22/08/2018,420,180,,Lagon,FS1,FS1_22-08-18.txt,FS1blank_22-08-18.txt,0.03857,8,12:06:01,09:11:01,S,Reef_services,ok
MOO18-R205,2018-08-22 12:03:23,5,0.366708537,0.0052867841,0.7660454244,0.3597999819,1.0651728185,27.5652433098,0.001321,0.03631,YES,Chrysiptera brownriggii,43,35,0.001321,180,240,0.03631,5,21/08/2018,22/08/2018,420,180,,Lagon,FS2,FS2_22-08-18.txt,FS2blank_22-08-18.txt,0.03857,8,12:06:01,09:11:01,S,Reef_services,ok
MOO18-R206,2018-08-22 12:03:23,6,0.2757929715,0.0046853185,0.9840386532,0.2687494732,1.0143613063,27.5602405254,0.000909,0.03706,YES,Chrysiptera brownriggii,40,31,0.000909,180,240,0.03706,6,21/08/2018,22/08/2018,420,180,,Lagon,FS2,FS2_22-08-18.txt,FS2blank_22-08-18.txt,0.03857,8,12:06:01,09:11:01,S,Reef_services,ok
MOO18-R207,2018-08-22 12:03:23,7,0.3087315702,0.0059577187,1.0386169551,0.3003523563,1.0884408738,27.5552713883,0.001012,0.03782,YES,Chrysiptera brownriggii,40,32,0.001012,180,240,0.03782,7,21/08/2018,22/08/2018,420,180,,Lagon,FS2,FS2_22-08-18.txt,FS2blank_22-08-18.txt,0.03857,8,12:06:01,09:11:01,S,Reef_services,ok
MOO18-R208,2018-08-22 12:43:37,1,10.2079474666,0.3111421578,33.4008304021,9.8027975288,32.5328339027,28.2723,0.0575,0.9727,YES,Ctenochaetus striatus,159,121,0.0575,300,180,0.9727,1,20/08/2018,22/08/2018,420,180,,Lagon,FS3,FS3_22-08-18.txt,FS3blank_22-08-18.txt,0.9727,4,12:46:01,09:13:01,M,Reef_services,ok
MOO18-R209,2018-08-22 12:43:37,2,3.2462234026,0.0530393627,12.2359692416,3.1461679614,13.3677908005,28.2723221477,0.016085,0.9727,YES,Ctenochaetus sp,106,72,0.016085,300,180,0.9727,2,20/08/2018,22/08/2018,420,180,,Lagon,FS3,FS3_22-08-18.txt,FS3blank_22-08-18.txt,0.9727,4,12:46:01,09:13:01,M,Reef_services,ok
MOO18-R210,2018-08-22 12:43:37,3,2.5552120417,0.0863463249,19.1396220334,2.4385732771,21.771770177,28.2722364865,0.031293,0.9727,YES,Balistapus undulatus,108,90,0.031293,300,180,0.9727,3,20/08/2018,22/08/2018,420,180,,Lagon,FS3,FS3_22-08-18.txt,FS3blank_22-08-18.txt,0.9727,4,12:46:01,09:13:01,M,Reef_services,ok
MOO18-R211,2018-08-22 12:49:52,1,16.0130618249,0.1863180329,25.6839298035,15.6812894944,54.1199804683,27.860230303,0.10797,4.4,YES,Ctenochaetus striatus,190,143,0.10797,420,300,4.4,1,20/08/2018,22/08/2018,420,180,,Lagon,FS4,FS4_22-08-18.txt,FS4blank_22-08-18.txt,4.4,4,12:52:05,09:14:00,L,Reef_services,ok
MOO18-R212,2018-08-22 12:49:52,2,7.9291698385,0.1200786984,34.296473144,7.7904238246,33.3043425482,27.8529719534,0.0731,4.4,YES,Sargocentron caudimaculatum,159,135,0.0731,420,300,4.4,2,20/08/2018,22/08/2018,420,180,,Lagon,FS4,FS4_22-08-18.txt,FS4blank_22-08-18.txt,4.4,4,12:52:05,09:14:00,L,Reef_services,ok
MOO18-R213,2018-08-22 12:49:52,3,6.8016911285,0.214720361,22.8490087255,6.5122309624,20.8449870677,27.8466918409,0.1042,4.4,YES,Pterois radiata,182,146,0.1042,420,300,4.4,3,20/08/2018,22/08/2018,420,180,,Lagon,FS4,FS4_22-08-18.txt,FS4blank_22-08-18.txt,4.4,4,12:52:05,09:14:00,L,Reef_services,ok
MOO18-R214,2018-08-23 11:32:56,1,0.4006339214,0.0055826862,1.0686053877,0.3918073228,1.1450271474,27.9159338317,0.00124,0.03329,YES,Centropyge flavissima,39,30.14,0.00124,240,180,0.03329,1,22/08/2018,23/08/2018,420,180,,Lagon,FS1,FS1_23-08-18.txt,FS1blank_23-08-18.txt,0.03857,8,11:35:01,08:55:01,S,Reef_services,ok
MOO18-R215,2018-08-23 11:32:56,2,0.2830732299,0.0014585836,0.5987792106,0.2812469436,0.6791317679,27.9191994118,0.001075,0.03404,YES,Centropyge flavissima,37,29,0.001075,240,180,0.03404,2,22/08/2018,23/08/2018,420,180,,Lagon,FS1,FS1_23-08-18.txt,FS1blank_23-08-18.txt,0.03857,8,11:35:01,08:55:01,S,Reef_services,ok
MOO18-R216,2018-08-23 11:32:56,3,0.3554287276,0.0027427358,0.9489244565,0.3514330096,0.9903171134,27.9224481761,0.000695,0.0348,YES,Acanthurus xanthopterus,32,26,0.000695,240,180,0.0348,3,22/08/2018,23/08/2018,420,180,,Lagon,FS1,FS1_23-08-18.txt,FS1blank_23-08-18.txt,0.03857,8,11:35:01,08:55:01,S,Reef_services,ok
MOO18-R217,2018-08-23 11:32:56,4,0.1043873768,0.0054037485,0.6776697187,0.0978205253,0.441849349,27.9257206874,0.000499,0.03555,YES,Aspidontus taeniatus,42,35,0.000499,240,180,0.03555,4,22/08/2018,23/08/2018,420,180,,Lagon,FS1,FS1_23-08-18.txt,FS1blank_23-08-18.txt,0.03857,8,11:35:01,08:55:01,S,Reef_services,ok
MOO18-R218,2018-08-23 11:32:56,5,0.3512111916,0.002757482,0.7320736618,0.3461644988,0.7593534229,27.9345697574,0.001103,0.03631,YES,Chrysiptera brownriggii,42,33,0.001103,240,180,0.03631,5,21/08/2018,23/08/2018,420,180,,Lagon,FS2,FS2_23-08-18.txt,FS2blank_23-08-18.txt,0.03857,8,11:35:01,08:55:01,S,Reef_services,ok
MOO18-R219,2018-08-23 11:32:56,6,0.3135092211,0.0054251368,0.8830765844,0.305048442,0.9214929527,27.9377817513,0.000719,0.03706,YES,Chrysiptera brownriggii,37,29,0.000719,240,180,0.03706,6,21/08/2018,23/08/2018,420,180,,Lagon,FS2,FS2_23-08-18.txt,FS2blank_23-08-18.txt,0.03857,8,11:35:01,08:55:01,S,Reef_services,ok
MOO18-R220,2018-08-23 11:32:56,7,0.1287489143,0.0016847385,0.2011430803,0.1266381989,0.1682377284,27.9408535126,0.000224,0.03782,YES,Dacyllus sp,23,18,0.000224,240,180,0.03782,7,21/08/2018,23/08/2018,420,180,,Lagon,FS2,FS2_23-08-18.txt,FS2blank_23-08-18.txt,0.03857,8,11:35:01,08:55:01,S,Reef_services,ok
MOO18-R221,2018-08-23 12:03:30,1,10.0896457177,0.1242068435,28.2766737394,9.8690105451,25.9941008505,27.4440379747,0.07193,0.9727,YES,Zebrasoma scopas,144,117,0.07193,300,180,0.9727,1,21/08/2018,23/08/2018,420,180,,Lagon,FS3,FS3_23-08-18.txt,FS3blank_23-08-18.txt,0.9727,4,12:05:01,09:14:01,M,Reef_services,ok
MOO18-R222,2018-08-23 12:03:30,2,11.9019991968,0.1603820163,21.6259709592,11.5900162844,21.0365471972,27.4448917197,0.07218,0.9727,YES,Zebrasoma scopas,146,120,0.07218,300,180,0.9727,2,21/08/2018,23/08/2018,420,180,,Lagon,FS3,FS3_23-08-18.txt,FS3blank_23-08-18.txt,0.9727,4,12:05:01,09:14:01,M,Reef_services,ok
MOO18-R223,2018-08-23 12:03:30,3,12.4085330025,0.1525941095,24.9654737547,12.1129448947,25.3234967282,27.4457435897,0.08335,0.9727,YES,Zebrasoma scopas,150,123,0.08335,300,180,0.9727,3,21/08/2018,23/08/2018,420,180,,Lagon,FS3,FS3_23-08-18.txt,FS3blank_23-08-18.txt,0.9727,4,12:05:01,09:14:01,M,Reef_services,ok
MOO18-R224,2018-08-23 12:13:55,1,26.787953599,0.1889991363,51.4945292344,26.5565162576,51.489403532,28.2839021455,0.15529,4.4,YES,Ctenochaetus striatus,200,151,0.15529,420,300,4.4,1,21/08/2018,23/08/2018,420,180,,Lagon,FS4,FS4_23-08-18.txt,FS4blank_23-08-18.txt,4.4,4,12:19:15,09:19:00,L,Reef_services,ok
MOO18-R225,2018-08-23 12:13:55,2,25.1645510219,0.3317860665,50.7468443984,24.4922811364,55.9502417587,28.2903439873,0.15385,4.4,YES,Ctenochaetus striatus,205,160,0.15385,420,300,4.4,2,21/08/2018,23/08/2018,420,180,,Lagon,FS4,FS4_23-08-18.txt,FS4blank_23-08-18.txt,4.4,4,12:19:15,09:19:00,L,Reef_services,ok
MOO18-R226,2018-08-23 12:13:55,3,16.6256439727,0.0477155237,33.6061135452,16.5529809916,31.5856575974,28.2962422163,0.11845,4.4,YES,Sargocentron caudimaculatum,173,155,0.11845,420,300,4.4,3,21/08/2018,23/08/2018,420,180,,Lagon,FS4,FS4_23-08-18.txt,FS4blank_23-08-18.txt,4.4,4,12:19:15,09:19:00,L,Reef_services,ok
MOO18-R227,2018-08-27 11:25:23,1,0.4691474355,0.002346635,0.7773480348,0.4656769302,0.6166392233,27.8695289102,0.001339,0.03329,YES,Zebrasoma scopas,32,26,0.001339,300,180,0.03329,1,26/08/2018,27/08/2018,420,180,,Lagon,FS1,FS1_27-08-18.txt,FS1blank_27-08-18.txt,0.03782,7,11:28:01,08:20:01,S,Reef_services,ok
MOO18-R228,2018-08-27 11:25:23,2,0.0875211563,0.0053589744,0.8137234607,0.0804930759,0.9162591289,27.8669482239,0.000927,0.03404,YES,Pseudocheilinus hexataenia,39,32,0.000927,300,180,0.03404,2,26/08/2018,27/08/2018,420,180,,Lagon,FS1,FS1_27-08-18.txt,FS1blank_27-08-18.txt,0.03782,7,11:28:01,08:20:01,S,Reef_services,ok
MOO18-R229,2018-08-27 11:25:23,3,0.1161275134,0.0013194716,0.3091514015,0.1143267723,0.35945646,27.8645231693,0.000181,0.0348,YES,Chromis acares,22,18,0.000181,300,180,0.0348,3,26/08/2018,27/08/2018,420,180,nageoire abim_e,Lagon,FS1,FS1_27-08-18.txt,FS1blank_27-08-18.txt,0.03782,7,11:28:01,08:20:01,S,Reef_services,ok
MOO18-R230,2018-08-27 11:25:23,4,0.252709313,0.0032274504,0.49938462,0.2458863595,0.8779235931,27.8619847394,0.000734,0.03555,YES,Dascyllus flavicaudus,32,24,0.000734,300,180,0.03555,4,26/08/2018,27/08/2018,420,180,,Lagon,FS1,FS1_27-08-18.txt,FS1blank_27-08-18.txt,0.03782,7,11:28:01,08:20:01,S,Reef_services,ok
MOO18-R231,2018-08-27 11:25:23,5,0.1205613933,0.0020255258,0.2326141585,0.1175635483,0.2873418844,27.8703108772,0.000306,0.03631,YES,Dascyllus flavicaudus,24,17,0.000306,300,180,0.03631,5,26/08/2018,27/08/2018,420,180,,Lagon,FS2,FS2_27-08-18.txt,FS2blank_27-08-18.txt,0.03782,7,11:28:01,08:20:01,S,Reef_services,ok
MOO18-R232,2018-08-27 11:25:23,6,0.0463131485,0.001161495,0.100345726,0.0437954677,0.0911697268,27.8682087013,0.000047,0.03706,YES,Dascyllus flavicaudus,13,10,0.000047,300,180,0.03706,6,26/08/2018,27/08/2018,420,180,Trop petit pour la chambre ,Lagon,FS2,FS2_27-08-18.txt,FS2blank_27-08-18.txt,0.03782,7,11:28:01,08:20:01,S,Reef_services,ok
MOO18-R233,2018-08-27 11:55:33,1,9.4839037863,0.0634706798,26.3595024385,9.3839496839,28.5672997317,28.0713853702,0.07727,0.9727,YES,Zebrasoma scopas,149,120,0.07727,300,180,0.9727,1,22/08/2018,27/08/2018,420,180,,Lagon,FS3,FS3_27-08-18.txt,FS3blank_27-08-18.txt,0.9727,4,11:57:12,08:21:01,M,Reef_services,ok
MOO18-R234,2018-08-27 11:55:33,2,11.0127553625,0.1171673377,24.0578053216,10.8600457881,19.9027482975,28.069673706,0.05984,0.9727,YES,Ctenochaetus striatus,158,110,0.05984,300,180,0.9727,2,22/08/2018,27/08/2018,420,180,,Lagon,FS3,FS3_27-08-18.txt,FS3blank_27-08-18.txt,0.9727,4,11:57:12,08:21:01,M,Reef_services,ok
MOO18-R236,2018-08-27 12:00:48,1,14.4340767504,0.2416982675,27.3775626836,14.1374937074,55.9998474689,28.1234208571,0.11529,4.4,YES,Myripristis sp ?,192,152,0.11529,420,300,4.4,1,22/08/2018,27/08/2018,420,180,,Lagon,FS4,FS4_27-08-18.txt,FS4blank_27-08-18.txt,4.4,4,12:03:01,08:22:15,L,Reef_services,ok
MOO18-R237,2018-08-27 12:00:48,2,14.5007438377,0.1309385073,49.6666098621,14.3198040539,50.4185520667,28.1206019625,0.105,4.4,YES,Chaetodon lunula,156,132,0.105,420,300,4.4,2,22/08/2018,27/08/2018,420,180,,Lagon,FS4,FS4_27-08-18.txt,FS4blank_27-08-18.txt,4.4,4,12:03:01,08:22:15,L,Reef_services,ok
MOO18-R238,2018-08-27 12:00:48,3,9.663621132,0.1221488858,34.5558376516,9.4957299138,39.1368817627,28.1175357434,0.08873,4.4,YES,Sargocentron caudimaculatum,175,143,0.08873,420,300,4.4,3,22/08/2018,27/08/2018,420,180,,Lagon,FS4,FS4_27-08-18.txt,FS4blank_27-08-18.txt,4.4,4,12:03:01,08:22:15,L,Reef_services,ok
MOO18-R239,2018-08-28 10:59:31,1,0.7425079809,0.0106692205,1.1983129943,0.7237312374,1.6436139871,27.8198578363,0.001273,0.03329,YES,Chaetodon ornatissimus,38,31,0.001273,180,180,0.03329,1,27/08/2018,28/08/2018,420,180,,Lagon,FS1,FS1_28-08-18.txt,FS1blank_28-08-18.txt,0.03857,8,11:02:01,09:28:01,S,Reef_services,ok
MOO18-R240,2018-08-28 10:59:31,2,0.4249319564,0.0144007075,1.3918896475,0.4021998973,1.3193470042,27.8176653719,0.002595,0.03404,YES,Pristiapogon exostigma,63,49,0.002595,180,180,0.03404,2,27/08/2018,28/08/2018,420,180,,Lagon,FS1,FS1_28-08-18.txt,FS1blank_28-08-18.txt,0.03857,8,11:02:01,09:28:01,S,Reef_services,ok
MOO18-R241,2018-08-28 10:59:31,3,-0.0274536413,0.0027042981,0.930545841,-0.0317928065,0.9561405033,27.8156449149,0.001752,0.0348,YES,Pristiapogon exostigma,51,44,0.001752,180,180,0.0348,3,27/08/2018,28/08/2018,420,180,Fish Died,Lagon,FS1,FS1_28-08-18.txt,FS1blank_28-08-18.txt,0.03857,8,11:02:01,09:28:01,S,Reef_services,ok
MOO18-R241,2018-08-28 10:59:31,3,0.4070130938,0.0210085855,0.7132136091,0.3774107758,-0.0318105913,28.3619077512,0.001752,0.0348,YES,Pristiapogon exostigma,51,44,0.001752,180,180,0.0348,3,27/08/2018,28/08/2018,420,180,Fish Died,Lagon,FS1,FS1_28-08-18.txt,FS1blank_28-08-18.txt,0.03857,8,11:02:01,09:28:01,S,Reef_services,ok
MOO18-R242,2018-08-28 10:59:31,4,0.2484880619,0.0056393139,0.777534628,0.2385780584,0.7978180268,27.8136758966,0.001027,0.03555,YES,Pristiapogon exostigma,47,37,0.001027,180,180,0.03555,4,27/08/2018,28/08/2018,420,180,,Lagon,FS1,FS1_28-08-18.txt,FS1blank_28-08-18.txt,0.03857,8,11:02:01,09:28:01,S,Reef_services,ok
MOO18-R243,2018-08-28 10:59:31,5,0.234698259,0.0069137431,0.5873326971,0.2232110254,0.9354299124,27.8231693339,0.000848,0.03631,YES,Ostorhinchus angustatus,43,37,0.000848,180,180,0.03631,5,27/08/2018,28/08/2018,420,180,,Lagon,FS2,FS2_28-08-18.txt,FS2blank_28-08-18.txt,0.03857,8,11:02:01,09:28:01,S,Reef_services,ok
MOO18-R244,2018-08-28 10:59:31,6,0.4442457894,0.0044690007,1.0118908405,0.4379326059,0.9532158355,27.8212850168,0.00084,0.03706,YES,Zebrasoma scopas,34,26,0.00084,180,180,0.03706,6,27/08/2018,28/08/2018,420,180,,Lagon,FS2,FS2_28-08-18.txt,FS2blank_28-08-18.txt,0.03857,8,11:02:01,09:28:01,S,Reef_services,ok
MOO18-R245,2018-08-28 10:59:31,7,0.4442093919,0.0058933788,1.0478906703,0.4369852673,2.131859473,27.8193117125,0.002297,0.03782,YES,Centropyge bispinosa,42,37,0.002297,180,180,0.03782,7,27/08/2018,28/08/2018,420,180,,Lagon,FS2,FS2_28-08-18.txt,FS2blank_28-08-18.txt,0.03857,8,11:02:01,09:28:01,S,Reef_services,ok
MOO18-R246,2018-08-28 11:17:52,1,4.625341879,0.0434373674,11.18238887,4.563048616,24.2943017957,28.1544664454,0.03848,0.9727,YES,Sargocentron microstoma,144,122,0.03848,540,180,0.9727,1,20/08/2018,28/08/2018,420,180,,Lagon,FS3,FS3_28-08-18.txt,FS3blank_28-08-18.txt,0.9727,4,11:22:10,09:29:00,M,Reef_services,ok
MOO18-R247,2018-08-28 11:17:52,2,0.9418916171,0.014894991,5.0968786686,0.9181700255,5.8938661824,28.1513260047,0.008406,0.9727,YES,Halichoeres trimaculatus,94,77,0.008406,540,180,0.9727,2,20/08/2018,28/08/2018,420,180,,Lagon,FS3,FS3_28-08-18.txt,FS3blank_28-08-18.txt,0.9727,4,11:22:10,09:29:00,M,Reef_services,ok
MOO18-R248,2018-08-28 11:17:52,3,1.5263662612,0.0311235289,5.2547587608,1.4770574102,5.0317551187,28.1482283158,0.00753,0.9727,YES,Centropyge flavissima,69,54,0.00753,540,180,0.9727,3,20/08/2018,28/08/2018,420,180,,Lagon,FS3,FS3_28-08-18.txt,FS3blank_28-08-18.txt,0.9727,4,11:22:10,09:29:00,M,Reef_services,ok
MOO18-R249,2018-08-29 13:09:28,1,0.2461207196,0.0007194344,0.4386056372,0.2446639285,1.061054008,27.8733058931,0.000502,0.006659,YES,Chrysiptera brownriggii,32,25,0.000502,180,180,0.006659,1,21/08/2018,29/08/2018,420,180,,Lagon,FS1,FS1_29-08-18.txt,FS1blank_29-08-18.txt,0.006659,8,13:12:01,09:14:01,XS,Reef_services,ok
MOO18-R250,2018-08-29 13:09:28,2,0.0388829474,0.0052046574,0.3406177821,0.0327820415,0.5415940906,27.8724532599,0.000439,0.006659,YES,Chrysiptera glauca,30,24,0.000439,180,180,0.006659,2,27/08/2018,29/08/2018,420,180,Fish Died,Lagon,FS1,FS1_29-08-18.txt,FS1blank_29-08-18.txt,0.006659,8,13:12:01,09:14:01,XS,Reef_services,ok
MOO18-R251,2018-08-29 13:09:28,3,0.1355750984,0.0015334103,0.2730580192,0.133283308,0.3995752377,27.8717553299,0.000252,0.006659,YES,Chrysiptera glauca,26,21,0.000252,180,180,0.006659,3,27/08/2018,29/08/2018,420,180,,Lagon,FS1,FS1_29-08-18.txt,FS1blank_29-08-18.txt,0.006659,8,13:12:01,09:14:01,XS,Reef_services,ok
MOO18-R252,2018-08-29 13:09:28,4,0.1049675397,0.0011240684,0.227395971,0.1029340164,0.3389866129,27.8710981447,0.000185,0.006659,YES,Chrysiptera glauca,23,19,0.000185,180,180,0.006659,4,27/08/2018,29/08/2018,420,180,,Lagon,FS1,FS1_29-08-18.txt,FS1blank_29-08-18.txt,0.006659,8,13:12:01,09:14:01,XS,Reef_services,ok
MOO18-R253,2018-08-29 13:09:28,5,0.0949002695,0.000941534,0.2709459741,0.0930953128,0.3097210947,27.8806540793,0.00018,0.006659,YES,Chrysiptera glauca,23,18,0.00018,180,180,0.006659,5,27/08/2018,29/08/2018,420,180,,Lagon,FS2,FS2_29-08-18.txt,FS2blank_29-08-18.txt,0.006659,8,13:12:01,09:14:01,XS,Reef_services,ok
MOO18-R254,2018-08-29 13:09:28,6,0.0957491295,0.0011370193,0.2295455367,0.0942318796,0.4012282697,27.8799091846,0.000158,0.006659,YES,Chrysiptera brownriggii,23,18,0.000158,180,180,0.006659,6,21/08/2018,29/08/2018,420,180,,Lagon,FS2,FS2_29-08-18.txt,FS2blank_29-08-18.txt,0.006659,8,13:12:01,09:14:01,XS,Reef_services,ok
MOO18-R255,2018-08-29 13:09:28,7,0.0973064914,0.0010201993,0.2203430992,0.0958116764,0.2379670577,27.8792614225,0.000118,0.006659,YES,Abudefduf sexfasciatus,20,14,0.000118,180,180,0.006659,7,27/08/2018,29/08/2018,420,180,,Lagon,FS2,FS2_29-08-18.txt,FS2blank_29-08-18.txt,0.006659,8,13:12:01,09:14:01,XS,Reef_services,ok
MOO18-R256,2018-08-29 13:19:24,1,1.44013864,0.0159496666,3.6331493816,1.4226374422,4.3113996801,27.8973774339,0.006213,0.9727,YES,Chaetodon ornatissimus,61,52,0.006213,540,180,0.9727,1,27/08/2018,29/08/2018,420,180,,Lagon,FS3,FS3_29-08-18.txt,FS3blank_29-08-18.txt,0.9727,4,13:22:01,09:20:00,M,Reef_services,ok
MOO18-R257,2018-08-29 13:19:24,2,1.1853306326,0.02670197,2.5625547867,1.1542799638,2.7172979046,27.8956856709,0.004,0.9727,YES,Chaetodon ornatissimus,53,46,0.004,540,180,0.9727,2,27/08/2018,29/08/2018,420,180,,Lagon,FS3,FS3_29-08-18.txt,FS3blank_29-08-18.txt,0.9727,4,13:22:01,09:20:00,M,Reef_services,ok
MOO18-R258,2018-08-29 13:19:24,3,1.2787568114,0.0552444705,2.6946918617,1.2231483338,3.0014385938,27.8941569642,0.0046,0.9727,YES,Chaetodon ornatissimus,56,48,0.0046,540,180,0.9727,3,27/08/2018,29/08/2018,420,180,,Lagon,FS3,FS3_29-08-18.txt,FS3blank_29-08-18.txt,0.9727,4,13:22:01,09:20:00,M,Reef_services,ok
MOO18-R259,2018-08-29 13:48:32,1,16.1368090512,0.5854684907,92.5426435297,15.2345559991,57.3822301958,28.1004997619,0.312762,4.4,YES,Melichthys vidua,205,183,0.312762,420,300,4.4,1,27/08/2018,29/08/2018,420,180,,Lagon,FS4,FS4_29-08-18.txt,FS4blank_29-08-18.txt,4.4,4,13:50:01,09:21:01,L,Reef_services,ok
MOO18-R260,2018-08-29 13:48:32,2,30.2430939704,0.2026332372,52.1824622596,30.0029866112,53.0094044601,28.099405594,0.178153,4.4,YES,Myripristis violacea,206,170,0.178153,420,300,4.4,2,27/08/2018,29/08/2018,420,180,,Lagon,FS4,FS4_29-08-18.txt,FS4blank_29-08-18.txt,4.4,4,13:50:01,09:21:01,L,Reef_services,ok
MOO18-R261,2018-08-29 13:48:32,3,18.4910419817,0.1506771532,26.3308997082,18.3152643503,25.6145416518,28.0984210942,0.136835,4.4,YES,Ctenochaetus striatus,190,145,0.136835,420,300,4.4,3,27/08/2018,29/08/2018,420,180,,Lagon,FS4,FS4_29-08-18.txt,FS4blank_29-08-18.txt,4.4,4,13:50:01,09:21:01,L,Reef_services,ok
MOO18-R262,2018-08-30 12:52:22,1,0.2899760078,0.0081008864,0.8347486739,0.2773833904,0.8713886004,26.6143469697,0.001156,0.03329,YES,Nectamia fusca,44,34,0.001156,180,180,0.03329,1,27/08/2018,30/08/2018,420,180,,Lagon,FS1,FS1_30-08-18.txt,FS1blank_30-08-18.txt,0.03857,8,12:55:01,08:22:01,S,Reef_services,ok
MOO18-R263,2018-08-30 12:52:22,2,0.2741868556,0.0029648519,0.6934088467,0.2703977592,1.3889081821,26.6111280343,0.001372,0.03404,YES,Chrysiptera glauca,46,36,0.001372,180,180,0.03404,2,27/08/2018,30/08/2018,420,180,,Lagon,FS1,FS1_30-08-18.txt,FS1blank_30-08-18.txt,0.03857,8,12:55:01,08:22:01,S,Reef_services,ok
MOO18-R264,2018-08-30 12:52:22,3,0.1580598095,0.0024784341,0.501630026,0.1534293363,0.5782651448,26.6080716746,0.000458,0.0348,YES,Chrysiptera glauca,31,25,0.000458,180,180,0.0348,3,27/08/2018,30/08/2018,420,180,,Lagon,FS1,FS1_30-08-18.txt,FS1blank_30-08-18.txt,0.03857,8,12:55:01,08:22:01,S,Reef_services,ok
MOO18-R265,2018-08-30 12:52:22,4,0.2347567936,0.0056227117,1.2045408455,0.2245379166,1.089941036,26.6051541126,0.000589,0.03555,YES,Mulet sp,41,33,0.000589,180,180,0.03555,4,27/08/2018,30/08/2018,420,180,,Lagon,FS1,FS1_30-08-18.txt,FS1blank_30-08-18.txt,0.03857,8,12:55:01,08:22:01,S,Reef_services,ok
MOO18-R266,2018-08-30 12:52:22,5,0.3167976054,0.0045312231,0.7503084985,0.3107975696,0.9507006538,26.622643617,0.000743,0.03631,YES,Chaetodon lunula,31,27,0.000743,180,180,0.03631,5,27/08/2018,30/08/2018,420,180,,Lagon,FS2,FS2_30-08-18.txt,FS2blank_30-08-18.txt,0.03857,8,12:55:01,08:22:01,S,Reef_services,ok
MOO18-R267,2018-08-30 12:52:22,6,0.0796267035,0.0021087695,0.2008218808,0.0762574011,0.214285433,26.6198652406,0.000165,0.03706,YES,Kuhlia mugil,28,23,0.000165,180,180,0.03706,6,27/08/2018,30/08/2018,420,180,,Lagon,FS2,FS2_30-08-18.txt,FS2blank_30-08-18.txt,0.03857,8,12:55:01,08:22:01,S,Reef_services,ok
MOO18-R268,2018-08-30 12:52:22,7,0.2028210407,0.0035716357,0.5868863289,0.1961077119,0.7950422684,26.6170864125,0.000492,0.03782,YES,Abudefduf sordidus,31,23,0.000492,180,180,0.03782,7,27/08/2018,30/08/2018,420,180,,Lagon,FS2,FS2_30-08-18.txt,FS2blank_30-08-18.txt,0.03857,8,12:55:01,08:22:01,S,Reef_services,ok
MOO18-R269,2018-08-30 13:02:29,1,1.236044576,0.0266810203,4.1540387046,1.2001955966,4.514384425,27.8512423336,0.01023,0.9727,NO,Pristiapogon exostigma,93,72,0.01023,600,180,0.9727,1,27/08/2018,30/08/2018,420,180,,Lagon,FS3,FS3_30-08-18.txt,FS3blank_30-08-18.txt,0.9727,4,13:04:01,08:28:01,M,Reef_services,ok
MOO18-R270,2018-08-30 13:02:29,2,0.5213165947,0.0045676769,1.3229845255,0.5142067441,1.2288509187,27.8475903905,0.002236,0.9727,NO,Chaetodon ornatissimus,48,39,0.002236,600,180,0.9727,2,27/08/2018,30/08/2018,420,180,,Lagon,FS3,FS3_30-08-18.txt,FS3blank_30-08-18.txt,0.9727,4,13:04:01,08:28:01,M,Reef_services,ok
MOO18-R271,2018-08-30 13:02:29,3,0.8880825026,0.0199378542,2.0793575416,0.8701967986,1.4479855869,27.8428669034,0.005475,0.9727,NO,Nectamia fusca,70,52,0.005475,600,180,0.9727,3,27/08/2018,30/08/2018,420,180,,Lagon,FS3,FS3_30-08-18.txt,FS3blank_30-08-18.txt,0.9727,4,13:04:01,08:28:01,M,Reef_services,ok
MOO18-R272,2018-08-30 13:19:16,1,15.7781294504,0.1528492857,22.5721234732,15.6591434604,18.5990868145,28.1312565899,0.120655,4.4,NO,Sargocentron caudimaculatum,175,144,0.120655,420,300,4.4,1,28/08/2018,30/08/2018,420,180,,Lagon,FS4,FS4_30-08-18.txt,FS4blank_30-08-18.txt,4.4,4,13:21:01,08:39:00,L,Reef_services,ok
MOO18-R273,2018-08-30 13:19:16,2,6.4755703524,0.9512775585,14.2984813682,5.6602858754,9.2418136708,28.1264626087,0.07429,4.4,NO,Pterois antennata,145,133,0.07429,420,300,4.4,2,28/08/2018,30/08/2018,420,180,,Lagon,FS4,FS4_30-08-18.txt,FS4blank_30-08-18.txt,4.4,4,13:21:01,08:39:00,L,Reef_services,ok
MOO18-R274,2018-08-30 13:19:16,3,12.0681761043,0.3094587039,61.3739676342,11.5911975425,60.1185492833,28.121704427,0.15153,4.4,NO,Melichthys vidua,180,160,0.15153,420,300,4.4,3,27/08/2018,30/08/2018,420,180,,Lagon,FS4,FS4_30-08-18.txt,FS4blank_30-08-18.txt,4.4,4,13:21:01,08:39:00,L,Reef_services,ok
MOO18-R275,2018-09-12 12:46:11,1,0.4256611641,0.0054705147,0.9062722625,0.4166995315,0.6829629858,28.4063480141,0.000886,0.03329,YES,Zebrasoma scopas,35,27,0.000886,180,180,0.03329,1,10/09/2018,12/09/2018,420,180,,PE,FS1,FS1_12-09-18.txt,FS1blank_12-09-18.txt,0.03782,8,12:49:40,09:38:00,S,Reef_services,ok
MOO18-R276,2018-09-12 12:46:11,2,0.2827470903,0.0046799843,0.9502824984,0.2751680091,0.972095535,28.4034278492,0.001188,0.03404,YES,Centropyge loricula,39,31,0.001188,180,180,0.03404,2,10/09/2018,12/09/2018,420,180,,PE,FS1,FS1_12-09-18.txt,FS1blank_12-09-18.txt,0.03782,8,12:49:40,09:38:00,S,Reef_services,ok
MOO18-R277,2018-09-12 12:46:11,3,0.4168218966,0.0091844249,1.3104422874,0.4025048906,1.2945629042,28.4003396613,0.001294,0.0348,YES,Chromis margaritifer,47,32,0.001294,180,180,0.0348,3,10/09/2018,12/09/2018,420,180,,PE,FS1,FS1_12-09-18.txt,FS1blank_12-09-18.txt,0.03782,8,12:49:40,09:38:00,S,Reef_services,ok
MOO18-R278,2018-09-12 12:46:11,4,0.2322065544,0.0070568585,0.7336070852,0.2209593247,0.7499364209,28.3972328706,0.000665,0.03555,YES,Chromis margaritifer,36,27,0.000665,180,180,0.03555,4,10/09/2018,12/09/2018,420,180,,PE,FS1,FS1_12-09-18.txt,FS1blank_12-09-18.txt,0.03782,8,12:49:40,09:38:00,S,Reef_services,ok
MOO18-R279,2018-09-12 12:46:11,5,0.1511428302,0.003061486,0.4852397693,0.147243332,0.6733704924,28.4108914491,0.000407,0.03631,YES,Centropyge bispinosa,27,21,0.000407,180,180,0.03631,5,10/09/2018,12/09/2018,420,180,,PE,FS2,FS2_12-09-18.txt,FS2blank_12-09-18.txt,0.03782,8,12:49:40,09:38:00,S,Reef_services,ok
MOO18-R280,2018-09-12 12:46:11,6,0.0769797961,0.004383813,0.2226476709,0.0704531874,0.3967491034,28.4075393939,0.00024,0.03706,YES,Pristiapogon exostigma,30,23,0.00024,180,180,0.03706,6,10/09/2018,12/09/2018,420,180,,PE,FS2,FS2_12-09-18.txt,FS2blank_12-09-18.txt,0.03782,8,12:49:40,09:38:00,S,Reef_services,ok
MOO18-R281,2018-09-12 12:59:05,1,1.3016477366,0.0127700547,2.4493433564,1.288986901,3.2141632044,28.1201605731,0.005291,0.9727,YES,Dascyllus flavicaudus,61,46,0.005291,720,180,0.9727,1,10/09/2018,12/09/2018,420,180,,PE,FS3,FS3_12-09-18.txt,FS3blank_12-09-18.txt,0.9727,4,13:01:05,09:40:00,M,Reef_services,ok
MOO18-R282,2018-09-12 12:59:05,2,1.1301684095,0.0148765614,2.0286395027,1.1096470265,2.4898253596,28.1130646572,0.003858,0.9727,YES,Dascyllus flavicaudus,54,42,0.003858,720,180,0.9727,2,10/09/2018,12/09/2018,420,180,,PE,FS3,FS3_12-09-18.txt,FS3blank_12-09-18.txt,0.9727,4,13:01:05,09:40:00,M,Reef_services,ok
MOO18-R283,2018-09-12 12:59:05,3,0.7956853497,0.009511944,2.6786909547,0.7837312631,2.7818377483,28.105234317,0.002721,0.9727,YES,Zebrasoma scopas,51,39,0.002721,720,180,0.9727,3,10/09/2018,12/09/2018,420,180,,PE,FS3,FS3_12-09-18.txt,FS3blank_12-09-18.txt,0.9727,4,13:01:05,09:40:00,M,Reef_services,ok
MOO18-R284,2018-09-12 13:08:45,1,7.8226770005,0.1496991587,34.3408897567,7.643963278,27.375952999,28.6457523055,0.08215,4.4,YES,Zebrasoma scopas,158,126,0.08215,420,300,4.4,1,10/09/2018,12/09/2018,420,180,,PE,FS4,FS4_12-09-18.txt,FS4blank_12-09-18.txt,4.4,4,13:11:00,09:41:00,L,Reef_services,ok
MOO18-R285,2018-09-12 13:08:45,2,16.1170613139,0.229755799,61.6191425726,15.7578219139,62.7546013216,28.6410099429,0.169709,4.4,YES,Arothron meleagris,176,140,0.169709,420,300,4.4,2,10/09/2018,12/09/2018,420,180,,PE,FS4,FS4_12-09-18.txt,FS4blank_12-09-18.txt,4.4,4,13:11:00,09:41:00,L,Reef_services,ok
MOO18-R286,2018-09-12 13:08:45,3,11.9020611291,0.2990438745,72.5607474288,11.5176849451,63.980088485,28.635448658,0.168455,4.4,YES,Melichthys vidua,192,155,0.168455,420,300,4.4,3,10/09/2018,12/09/2018,420,180,,PE,FS4,FS4_12-09-18.txt,FS4blank_12-09-18.txt,4.4,4,13:11:00,09:41:00,L,Reef_services,ok
MOO18-R287,2018-09-13 12:22:49,1,0.6798421801,0.0188074848,1.7310752877,0.641279784,2.7586845872,28.2922512453,0.002832,0.03329,YES,Abudefduf sordidus,56,43,0.002832,180,180,0.03329,1,NA,13/09/2018,420,180,,Lagon,FS1,FS1_13-09-18.txt,FS1blank_13-09-18.txt,0.03857,8,12:27:00,17:49:00,S,Reef_services,ok
MOO18-R288,2018-09-13 12:22:49,2,0.269474327,0.00601616,0.7299986605,0.2590962222,1.5162907241,28.2910248047,0.001175,0.03404,YES,Abudefduf sordidus,43,32,0.001175,180,180,0.03404,2,NA,13/09/2018,420,180,,Lagon,FS1,FS1_13-09-18.txt,FS1blank_13-09-18.txt,0.03857,8,12:27:00,17:49:00,S,Reef_services,ok
MOO18-R289,2018-09-13 12:22:49,3,0.4969993195,0.0066919837,0.8254499011,0.4810351551,1.6132693549,28.2895989969,0.001811,0.0348,YES,Chromis iomelas,39,34,0.001811,180,180,0.0348,3,11/09/2018,13/09/2018,420,180,No Tail,Lagon,FS1,FS1_13-09-18.txt,FS1blank_13-09-18.txt,0.03857,8,12:27:00,17:49:00,S,Reef_services,ok
MOO18-R290,2018-09-13 12:22:49,4,0.4221504983,0.0070746096,0.9958997179,0.4103130193,0.9274030368,28.288072916,0.001512,0.03555,YES,Chromis iomelas,41,32,0.001512,180,180,0.03555,4,11/09/2018,13/09/2018,420,180,,Lagon,FS1,FS1_13-09-18.txt,FS1blank_13-09-18.txt,0.03857,8,12:27:00,17:49:00,S,Reef_services,ok
MOO18-R291,2018-09-13 12:22:49,5,0.1194145405,0.0034222141,0.3896190968,0.1144806038,0.3572650788,28.2976269571,0.00036,0.03631,YES,Chromis iomelas,27,22,0.00036,180,180,0.03631,5,11/09/2018,13/09/2018,420,180,,Lagon,FS2,FS2_13-09-18.txt,FS2blank_13-09-18.txt,0.03857,8,12:27:00,17:49:00,S,Reef_services,ok
MOO18-R292,2018-09-13 12:22:49,6,0.4118510413,0.0062252163,1.6550025403,0.403371563,2.0218238911,28.2958946468,0.001321,0.03706,YES,Crenimugil crenilabris,57,48,0.001321,180,180,0.03706,6,NA,13/09/2018,420,180,Fish Died,Lagon,FS2,FS2_13-09-18.txt,FS2blank_13-09-18.txt,0.03857,8,12:27:00,17:49:00,S,Reef_services,ok
MOO18-R293,2018-09-13 12:22:49,7,0.0350077018,0.0080213023,0.3665740316,0.0241445035,0.4653310988,28.2940132231,0.000407,0.03782,YES,Crenimugil crenilabris,40,33,0.000407,180,180,0.03782,7,NA,13/09/2018,420,180,,Lagon,FS2,FS2_13-09-18.txt,FS2blank_13-09-18.txt,0.03857,8,12:27:00,17:49:00,S,Reef_services,ok
MOO18-R294,2018-09-13 12:05:42,1,6.5470458337,0.1122846168,29.6031941578,6.4139152076,39.067079487,28.4285932737,0.093944,0.9727,YES,Balistapus undulatus,156,127,0.093944,600,180,0.9727,1,10/09/2018,13/09/2018,420,180,,Lagon,FS3,FS3_13-09-18.txt,FS3blank_13-09-18.txt,0.9727,3,12:08:00,17:54:00,M,Reef_services,ok
MOO18-R295,2018-09-13 12:05:42,2,1.7631483639,0.0380808907,7.9351072292,1.7097932714,9.3402696141,28.4266232295,0.015973,0.9727,YES,Epinephelus merra,110,94,0.015973,600,180,0.9727,2,11/09/2018,13/09/2018,420,180,,Lagon,FS3,FS3_13-09-18.txt,FS3blank_13-09-18.txt,0.9727,3,12:08:00,17:54:00,M,Reef_services,ok
MOO18-R296,2018-09-13 11:59:06,1,18.6600856241,0.9984020431,91.6793257993,17.256405098,92.3705922049,28.5992755598,0.248785,4.4,YES,Odonus niger,285,175,0.248785,420,300,4.4,1,11/09/2018,13/09/2018,420,180,,Lagon,FS4,FS4_13-09-18.txt,FS4blank_13-09-18.txt,4.4,4,12:01:30,18:00:00,L,Reef_services,ok
MOO18-R297,2018-09-13 11:59:06,2,11.1475705521,0.0847300805,44.0806824888,11.0136653525,49.1471198927,28.5969436346,0.15503,4.4,YES,Epinephelus merra,226,188,0.15503,420,300,4.4,2,11/09/2018,13/09/2018,420,180,,Lagon,FS4,FS4_13-09-18.txt,FS4blank_13-09-18.txt,4.4,4,12:01:30,18:00:00,L,Reef_services,ok
MOO18-R298,2018-09-13 11:59:06,3,-2.0304400589,18.2267902084,136.3772432172,-41.370871035,40.4091026489,28.5948821135,0.117265,4.4,YES,Epinephelus merra,203,170,0.117265,420,300,4.4,3,11/09/2018,13/09/2018,420,180,,Lagon,FS4,FS4_13-09-18.txt,FS4blank_13-09-18.txt,4.4,4,12:01:30,18:00:00,L,Reef_services,ok
MOO18-R299,2018-11-06 11:18:18,1,0.6657261595,0.0089626088,1.7263455034,0.6541201715,2.1423167606,28.5076416422,0.00393,0.03329,YES,Neocirrhites armatus,59,50,0.00393,180,180,0.03329,1,01/11/2018,06/11/2018,420,180,,PE,FS1,FS1_06-11-18.txt,FS1blank_06-11-18.txt,0.03857,8,11:21:01,09:15:01,S,Reef_services,ok
MOO18-R300,2018-11-06 11:18:18,2,0.1681690929,0.0087576746,0.8276427682,0.1515337789,0.9252263814,28.501748064,0.000797,0.03404,YES,Epinephelus merra,43,37,0.000797,180,180,0.03404,2,05/11/2018,06/11/2018,420,180,,Lagon,FS1,FS1_06-11-18.txt,FS1blank_06-11-18.txt,0.03857,8,11:21:01,09:15:01,S,Reef_services,ok
MOO18-R301,2018-11-06 11:18:18,3,1.0001776766,0.0260077775,1.8939813141,0.9428864859,1.8414229518,28.4959781818,0.003063,0.0348,YES,Centropyge bispinosa,48,41,0.003063,180,180,0.0348,3,01/11/2018,06/11/2018,420,180,,PE,FS1,FS1_06-11-18.txt,FS1blank_06-11-18.txt,0.03857,8,11:21:01,09:15:01,S,Reef_services,ok
MOO18-R302,2018-11-06 11:18:18,4,0.4427884595,0.0032559358,1.2707529834,0.4371263378,1.3502704762,28.4902718777,0.001503,0.03555,YES,Acanthurus pyroferus,44,34,0.001503,180,180,0.03555,4,01/11/2018,06/11/2018,420,180,,PE,FS1,FS1_06-11-18.txt,FS1blank_06-11-18.txt,0.03857,8,11:21:01,09:15:01,S,Reef_services,ok
MOO18-R303,2018-11-06 11:18:18,5,0.1120357394,0.007441389,0.5713564878,0.0987833129,0.1875784934,28.498830812,0.00042,0.03631,YES,Aspidontus taeniatus,40,34,0.00042,180,180,0.03631,5,05/11/2018,06/11/2018,420,180,,Lagon,FS2,FS2_06-11-18.txt,FS2blank_06-11-18.txt,0.03857,8,11:21:01,09:15:01,S,Reef_services,ok
MOO18-R304,2018-11-06 11:18:18,6,0.1994522253,0.0059812067,0.4905063098,0.1902955097,0.5836161442,28.4928410203,0.001828,0.03706,YES,?,50,42,0.001828,180,180,0.03706,6,05/11/2018,06/11/2018,420,180,,Lagon,FS2,FS2_06-11-18.txt,FS2blank_06-11-18.txt,0.03857,8,11:21:01,09:15:01,S,Reef_services,ok
MOO18-R305,2018-11-06 11:18:18,7,0.3903320408,0.0072179184,1.6168667363,0.3779281143,1.4912193742,28.4867308232,0.001475,0.03782,YES,Centropyge flavissima,40,33,0.001475,180,180,0.03782,7,01/11/2018,06/11/2018,420,180,,PE,FS2,FS2_06-11-18.txt,FS2blank_06-11-18.txt,0.03857,8,11:21:01,09:15:01,S,Reef_services,ok
MOO18-R306,2018-11-06 11:31:44,1,1.4718577501,0.0129102743,3.8294345026,1.4566947358,4.5421209498,28.3269153302,0.006555,0.9727,YES,Plectroglyphidodon dickii,68,53,0.006555,720,180,0.9727,1,01/11/2018,06/11/2018,420,180,,PE,FS3,FS3_06-11-18.txt,FS3blank_06-11-18.txt,0.9727,4,11:36:01,09:16:01,M,Reef_services,ok
MOO18-R307,2018-11-06 11:31:44,2,2.1256158174,0.0173899831,6.4278487383,2.0978316183,10.0248142967,28.3108667399,0.00921,0.9727,YES,Dascyllus flavicaudus,73,58,0.00921,720,180,0.9727,2,01/11/2018,06/11/2018,420,180,,PE,FS3,FS3_06-11-18.txt,FS3blank_06-11-18.txt,0.9727,4,11:36:01,09:16:01,M,Reef_services,ok
MOO18-R308,2018-11-06 11:31:44,3,2.3527132146,0.0061084372,6.8160464097,2.3463216127,7.8895611405,28.294640519,0.009072,0.9727,YES,Acanthurus nigricans,78,61,0.009072,720,180,0.9727,3,01/11/2018,06/11/2018,420,180,,PE,FS3,FS3_06-11-18.txt,FS3blank_06-11-18.txt,0.9727,4,11:36:01,09:16:01,M,Reef_services,ok
MOO18-R309,2018-11-07 11:54:01,1,0.1854272443,0.0077045648,0.8873289333,0.1748402638,0.8505771722,28.4961369755,0.000808,0.03329,YES,Cirrhitichthys oxycephalus,41,34,0.000808,180,180,0.03329,1,05/11/2018,07/11/2018,420,180,,Lagon,FS1,FS1_07-11-18.txt,FS1blank_07-11-18.txt,0.03857,8,11:59:01,09:05:01,S,Reef_services,ok
MOO18-R310,2018-11-07 11:54:01,2,0.2382848646,0.0064295181,1.065350805,0.228239786,1.1425006234,28.4902077295,0.001312,0.03404,YES,Cirrhitichthys oxycephalus,47,39,0.001312,180,180,0.03404,2,05/11/2018,07/11/2018,420,180,,Lagon,FS1,FS1_07-11-18.txt,FS1blank_07-11-18.txt,0.03857,8,11:59:01,09:05:01,S,Reef_services,ok
MOO18-R311,2018-11-07 11:54:01,3,0.3985164342,0.0048583562,1.8458993872,0.3882369173,1.655615449,28.4840335393,0.001145,0.0348,YES,Pomacentrus pavo,44,34,0.001145,180,180,0.0348,3,05/11/2018,07/11/2018,420,180,,Lagon,FS1,FS1_07-11-18.txt,FS1blank_07-11-18.txt,0.03857,8,11:59:01,09:05:01,S,Reef_services,ok
MOO18-R312,2018-11-07 11:54:01,4,0.3438248515,0.0056934252,0.9815149062,0.334292817,1.3569687281,28.4776927716,0.001055,0.03555,YES,Pomacentrus pavo,42,33,0.001055,180,180,0.03555,4,05/11/2018,07/11/2018,420,180,,Lagon,FS1,FS1_07-11-18.txt,FS1blank_07-11-18.txt,0.03857,8,11:59:01,09:05:01,S,Reef_services,ok
MOO18-R313,2018-11-07 11:54:01,5,0.3067131217,0.006863385,0.7064458317,0.2926929585,1.3577081824,28.4804985476,0.00092,0.03631,YES,Pristiapogon fraenatus,45,35,0.00092,180,180,0.03631,5,05/11/2018,07/11/2018,420,180,,Lagon,FS2,FS2_07-11-18.txt,FS2blank_07-11-18.txt,0.03857,8,11:59:01,09:05:01,S,Reef_services,ok
MOO18-R314,2018-11-07 11:54:01,6,0.2613654642,0.0047636307,0.5925774357,0.2541253557,0.3676412556,28.4740230797,0.000858,0.03706,YES,Pristiapogon fraenatus,43,35,0.000858,180,180,0.03706,6,05/11/2018,07/11/2018,420,180,,Lagon,FS2,FS2_07-11-18.txt,FS2blank_07-11-18.txt,0.03857,8,11:59:01,09:05:01,S,Reef_services,ok
MOO18-R315,2018-11-07 11:54:01,7,0.2589431128,0.0067530068,0.7240134448,0.2475690399,0.6850158712,28.4680585809,0.000728,0.03782,YES,Pristiapogon fraenatus,38,32,0.000728,180,180,0.03782,7,05/11/2018,07/11/2018,420,180,,Lagon,FS2,FS2_07-11-18.txt,FS2blank_07-11-18.txt,0.03857,8,11:59:01,09:05:01,S,Reef_services,ok
MOO18-R316,2018-11-07 11:40:36,1,1.8619494873,0.0341111606,5.3708693826,1.8006538778,5.339223426,28.4054439909,0.01919,0.9727,YES,Dendrochirus biocellatus,100,83,0.01919,420,180,0.9727,1,05/11/2018,07/11/2018,420,180,,Lagon,FS3,FS3_07-11-18.txt,FS3blank_07-11-18.txt,0.9727,4,11:43:01,09:06:00,M,Reef_services,ok
MOO18-R317,2018-11-07 11:40:36,2,1.7013245419,0.0180375953,12.8215833753,1.6796947043,11.7910006944,28.3973410286,0.0163,0.9727,YES,Odonus niger,105,75,0.0163,420,180,0.9727,2,05/11/2018,07/11/2018,420,180,,Lagon,FS3,FS3_07-11-18.txt,FS3blank_07-11-18.txt,0.9727,4,11:43:01,09:06:00,M,Reef_services,ok
MOO18-R318,2018-11-07 11:40:36,3,2.3899164942,0.0183691403,18.4951561286,2.3588579839,17.7747189384,28.3883508295,0.02113,0.9727,YES,Odonus niger,114,82,0.02113,420,180,0.9727,3,05/11/2018,07/11/2018,420,180,,Lagon,FS3,FS3_07-11-18.txt,FS3blank_07-11-18.txt,0.9727,4,11:43:01,09:06:00,M,Reef_services,ok
MOO18-R319,2018-11-07 11:35:35,1,3.2268530614,0.1832965298,7.4908669801,3.0216479527,29.8272439386,28.3588505578,0.0423,4.4,YES,Cephalopholis argus,185,155,0.0423,420,300,4.4,1,05/11/2018,07/11/2018,420,180,,Lagon,FS4,FS4_07-11-18.txt,FS4blank_07-11-18.txt,4.4,4,11:38:01,09:07:01,L,Reef_services,ok
MOO18-R320,2018-11-07 11:35:35,2,9.8491171144,1.2679845579,49.8482243323,8.3435247709,48.2132275592,28.3488645604,0.1384,4.4,YES,Epinephelus merra,214,175,0.1384,420,300,4.4,2,05/11/2018,07/11/2018,420,180,,Lagon,FS4,FS4_07-11-18.txt,FS4blank_07-11-18.txt,4.4,4,11:38:01,09:07:01,L,Reef_services,ok
MOO18-R321,2018-11-07 11:35:35,3,11.9770877508,0.2932939563,68.2550170319,11.6067921057,47.3353467657,28.3384612483,0.1651,4.4,YES,Balistapus undulatus,183,153,0.1651,420,300,4.4,3,05/11/2018,07/11/2018,420,180,,Lagon,FS4,FS4_07-11-18.txt,FS4blank_07-11-18.txt,4.4,4,11:38:01,09:07:01,L,Reef_services,ok
MOO18-R322,2018-11-08 12:45:13,1,0.1854534418,0.0015115643,0.3342498735,0.1833596305,0.0640628754,28.1502977273,0.000517,0.006659,YES,Pomacentrus pavo,34,27,0.000517,180,180,0.006659,1,05/11/2018,08/11/2018,420,180,,Lagon,FS1,FS1_08-11-18.txt,FS1blank_08-11-18.txt,0.006659,8,12:49:01,09:20:01,XS,Reef_services,ok
MOO18-R323,2018-11-08 12:45:13,2,0.0559128073,0.0008247993,0.191274212,0.0547434598,0.2097049466,28.1463238922,0.000414,0.006659,YES,Scorpaenidae sp,30,25,0.000414,180,180,0.006659,2,05/11/2018,08/11/2018,420,180,,Lagon,FS1,FS1_08-11-18.txt,FS1blank_08-11-18.txt,0.006659,8,12:49:01,09:20:01,XS,Reef_services,ok
MOO18-R324,2018-11-08 12:45:13,3,0.0172786597,0.0005825385,0.0432265593,0.0163457253,0.0433745959,28.1421807163,0.000023,0.006659,YES,Dascyllus aruanus,12,9,0.000023,180,180,0.006659,3,05/11/2018,08/11/2018,420,180,,Lagon,FS1,FS1_08-11-18.txt,FS1blank_08-11-18.txt,0.006659,8,12:49:01,09:20:01,XS,Reef_services,ok
MOO18-R325,2018-11-08 12:45:13,4,0.0614800842,0.0016643319,0.1247677123,0.059147537,0.1280380606,28.1380226119,0.000092,0.006659,YES,Dascyllus flavicaudus,16,13,0.000092,180,180,0.006659,4,05/11/2018,08/11/2018,420,180,,Lagon,FS1,FS1_08-11-18.txt,FS1blank_08-11-18.txt,0.006659,8,12:49:01,09:20:01,XS,Reef_services,ok
MOO18-R326,2018-11-08 12:45:13,5,0.1077195136,0.0012991975,0.1756388448,0.1057967052,0.2217830662,28.1509908352,0.000345,0.006659,YES,Pristiapogon fraenatus,32,26,0.000345,180,180,0.006659,5,05/11/2018,08/11/2018,420,180,,Lagon,FS2,FS2_08-11-18.txt,FS2blank_08-11-18.txt,0.006659,8,12:49:01,09:20:01,XS,Reef_services,ok
MOO18-R327,2018-11-08 12:45:13,6,0.0859765664,0.0007832167,0.1838542912,0.0843612456,0.1886282822,28.1467107312,0.000251,0.006659,YES,Pristiapogon fraenatus,30,25,0.000251,180,180,0.006659,6,05/11/2018,08/11/2018,420,180,,Lagon,FS2,FS2_08-11-18.txt,FS2blank_08-11-18.txt,0.006659,8,12:49:01,09:20:01,XS,Reef_services,ok
MOO18-R328,2018-11-08 12:45:13,7,0.1095385354,0.0009654932,0.2475270441,0.1080812132,0.2633831466,28.1421818442,0.000298,0.006659,YES,Pristiapogon fraenatus,31,25,0.000298,180,180,0.006659,7,05/11/2018,08/11/2018,420,180,,Lagon,FS2,FS2_08-11-18.txt,FS2blank_08-11-18.txt,0.006659,8,12:49:01,09:20:01,XS,Reef_services,ok
MOO18-R329,2018-11-08 12:30:29,1,3.2039970156,0.0490196537,22.6301852661,3.1459040269,23.5643337815,28.1859420141,0.034741,0.9727,YES,Odonus niger,136,94,0.034741,420,180,0.9727,1,05/11/2018,08/11/2018,420,180,,Lagon,FS3,FS3_08-11-18.txt,FS3blank_08-11-18.txt,0.9727,4,12:32:01,09:21:01,M,Reef_services,ok
MOO18-R330,2018-11-08 12:30:29,2,3.8580968076,0.0381462295,26.8318193988,3.8096056488,28.3990779965,28.1807020543,0.03683,0.9727,YES,Odonus niger,137,97,0.03683,420,180,0.9727,2,05/11/2018,08/11/2018,420,180,,Lagon,FS3,FS3_08-11-18.txt,FS3blank_08-11-18.txt,0.9727,4,12:32:01,09:21:01,M,Reef_services,ok
MOO18-R331,2018-11-08 12:30:29,3,2.4202859962,0.0476525787,18.5820732491,2.3562255456,19.7596569766,28.1749705238,0.03066,0.9727,YES,Odonus niger,137,93,0.03066,420,180,0.9727,3,05/11/2018,08/11/2018,420,180,,Lagon,FS3,FS3_08-11-18.txt,FS3blank_08-11-18.txt,0.9727,4,12:32:01,09:21:01,M,Reef_services,ok
MOO18-R332,2018-11-08 12:26:38,1,7.4354108211,0.2858190532,35.4057433066,7.0063000956,40.3504578455,28.2511311485,0.13805,4.4,YES,Scarus schlegeli,210,167,0.13805,420,300,4.4,1,06/11/2018,08/11/2018,420,180,,Lagon,FS4,FS4_08-11-18.txt,FS4blank_08-11-18.txt,4.4,4,12:29:00,09:22:00,L,Reef_services,ok
MOO18-R333,2018-11-08 12:26:38,2,15.7361935358,0.0853556589,67.5739240014,15.5841659499,70.2296739532,28.2448612164,0.1444,4.4,YES,Scarus schlegeli,210,166,0.1444,420,300,4.4,2,06/11/2018,08/11/2018,420,180,,Lagon,FS4,FS4_08-11-18.txt,FS4blank_08-11-18.txt,4.4,4,12:29:00,09:22:00,L,Reef_services,ok
